created_at,tweet,username,hashtags,cashtags,retweets_count,likes_count,replies_count,coin
2021-10-18 17:30:15 UTC,Bitcoin or Ethereum? Let's hear 's thoughts from last week's edition of The Market Report!   https://t.co/7M1PlYXRsT,cointelegraph,[],[],19,70,115,ETH
2021-10-18 16:41:06 UTC,"A decisive break above Ethereum's psychological resistance could propel ETH above $6,000.  https://t.co/WQiwiisbf4",cointelegraph,[],[],41,180,18,ETH
2021-10-18 06:00:03 UTC,A stuck or a pending Ethereum transaction might leave some users confused. But there are two methods to cancel or modify it:  https://t.co/rEjdxBZZyy,cointelegraph,[],[],47,167,23,ETH
2021-10-17 22:00:35 UTC,"BTC soared above its $58,000 resistance price. Bulls are attempting a comeback at SOL, while a breakout and close at $4,027.88 could pave the way for ETH to an all-time high.  https://t.co/0wJycXZrwr",cointelegraph,[],[],42,150,71,ETH
2021-10-17 21:36:34 UTC,"Bitcoin’s price action remains strong and a rally to a new all-time high is likely to catalyze a breakout from ETH, $SOL, MATIC, and $FTM.  https://t.co/ib8VcXFLOv",cointelegraph,[],"['sol', 'ftm']",53,239,26,ETH
2021-10-17 21:00:11 UTC,Crypto 101.  A stuck or a pending Ethereum transaction might leave some users confused. But there are two methods to cancel or modify it:  https://t.co/NfZcO6erad,cointelegraph,[],[],24,99,70,ETH
2021-10-17 15:15:03 UTC,"Having second thoughts? It is possible to modify or cancel your pending Ethereum transactions, with two methods available.  https://t.co/5wuB0vjlVz",cointelegraph,[],[],26,81,19,ETH
2021-10-16 19:00:39 UTC,Pre-2015 NFT collectibles on the Counterparty blockchain are finding renewed interest on Ethereum and Polygon thanks in part to the Emblem Vault bridge  https://t.co/VDXylcTBRL,cointelegraph,[],[],24,81,20,ETH
2021-10-16 03:07:00 UTC,"After revealing plans to test BTC and ETH for mortgage payments, one of the biggest mortgage lenders in the US retracts the project.  https://t.co/Dmh86wQ7vM",cointelegraph,[],[],30,189,34,ETH
2021-10-15 19:29:03 UTC,Pre-2015 NFT collectibles on the Counterparty blockchain are finding renewed interest on Ethereum thanks in part to the Emblem Vault bridge  https://t.co/HORAlnmlY5,cointelegraph,[],[],5,18,3,ETH
2021-10-15 14:30:24 UTC,"To determine where crypto goes next, it’s always best to talk to the experts.    of  provides her thoughts on ETH's future while revealing her ideal superpowers.  https://t.co/pey9qPgcdv  (Reporting via )",cointelegraph,[],[],4,21,9,ETH
2021-10-14 23:00:35 UTC,ETH is edging towards $3.8K and bulls are hoping to run it up even more before Friday's option expiry.  https://t.co/an3B86KlEX,cointelegraph,[],[],75,313,31,ETH
2021-10-14 21:01:03 UTC,"Ethereum price briefly surged above $3,800 for the first time in a month and  says this possibly secures the bulls' victory in Friday's $385 million ETH options expiry.  https://t.co/baJCDMWWgu",cointelegraph,[],[],9,67,8,ETH
2021-10-14 20:38:12 UTC,"Bullish Bitcoin billionaires are shutting down Jamie Dimon's argument that BTC is ""worthless.""   Starwood Capital Group co-founder Barry Sternlicht defends it as a worthy investment amidst inflation, but is Ethereum the better bet?  https://t.co/Qd6I6fYWvX",cointelegraph,[],[],21,74,12,ETH
2021-10-14 16:16:12 UTC,"""Ethereum is competing with banks, Amazon, etc. #Bitcoin is competing with gold. The upside goes to BTC."" -   ""I have love for Bitcoin, but I think Ethereum has the higher upside""-",cointelegraph,['bitcoin'],[],6,25,5,ETH
2021-10-14 15:30:36 UTC,"Not all billionaires are bearish on Bitcoin.   Starwood Capital Group co-founder Barry Sternlicht defends BTC as a worthy investment amidst inflation, but is Ethereum the better bet?  https://t.co/MPGPQN9lsd",cointelegraph,[],[],11,74,22,ETH
2021-10-14 13:04:33 UTC,Aurora received $12 million in funding to expand cross-chain capabilities in the Ethereum ecosystem. Story by .  https://t.co/qfuHmhHsHN,cointelegraph,[],[],35,120,12,ETH
2021-10-14 11:45:16 UTC,"Hodlers, should long-term investors back Bitcoin, Ethereum, or a combination of both?",cointelegraph,[],[],3,64,36,ETH
2021-10-14 10:30:11 UTC,"Not all billionaires are bearish on Bitcoin.   Starwood Capital Group co-founder Barry Sternlicht defends BTC as a worthy investment amidst rising inflation, but is Ethereum the better bet?  https://t.co/ZXPeW3fmiE",cointelegraph,[],[],17,98,15,ETH
2021-10-14 05:48:06 UTC,"Billionaires Barry Sternlicht and Mark Cuban have praised Bitcoin and defended it against claims it's “worthless”, but both of them think Ethereum has some even more desirable properties.  https://t.co/qwgFwgAMNw",cointelegraph,[],[],177,519,76,ETH
2021-10-13 18:00:28 UTC,"Getting ready for tomorrow's edition of The Market Report?  Catch up with last week's highlights first where our hosts talked about ETH, BTC, and crypto security.   Click here to watch the full show:  https://t.co/6N6EDmU55S  https://t.co/2NXGNhCnL5",cointelegraph,[],[],6,15,11,ETH
2021-10-13 13:15:20 UTC,"When explaining the difference between Ethereum and Bitcoin,  said, “Bitcoin is a platform where the value of the ecosystem comes from the value of the currency, but in Ethereum the value of the currency comes from the value of the ecosystem.”",cointelegraph,[],[],20,90,13,ETH
2021-10-13 10:45:03 UTC,Vitalik said they can't stop us because we're too strong!   Hear what the Ethereum co-founder had to say in a recent interview.  https://t.co/trdDmFex5c  https://t.co/EPj07XlHH4,cointelegraph,[],[],78,442,68,ETH
2021-10-13 04:00:36 UTC,"If the community is strong enough, detractors don't matter. See what the Ethereum co-founder had to say in his recent interview.  https://t.co/JoUFZ7gZYp",cointelegraph,[],[],29,96,14,ETH
2021-10-12 23:37:01 UTC,"“In some ways, the number of critics matters much less than the strength of the supporters.”  The co-founder of Ethereum, Vitalik Buterin spoke about DAOs, ETH, and NFTs in a recent interview.   https://t.co/lYGkEHU4Nk",cointelegraph,[],[],22,101,20,ETH
2021-10-12 22:15:01 UTC,Dreams of a Bitcoin ETF have bulls eyeing Ethereum highs.   $4K ETH might be just what we need to get the party started.  https://t.co/ZLXDQBr3j4,cointelegraph,[],[],39,170,12,ETH
2021-10-12 21:52:01 UTC,"A stumbling block.   Despite an interesting start to Q4, the ETH/BTC exchange rate has fallen around 12% for the first time in over two months.   https://t.co/EiSGBrMUOw",cointelegraph,[],[],6,36,8,ETH
2021-10-12 20:50:27 UTC,Did you miss this? Find out why Ethereum could upend Bitcoin as the number one crypto.,cointelegraph,[],[],2,23,4,ETH
2021-10-12 20:45:05 UTC,"Which blockchain is the next #Ethereum killer? None, says    For more insights, check out his full interview for The Market Report on our Youtube channel.   Like and subscribe!  https://t.co/rRXwD1ws8k  https://t.co/pkAJUBPret",cointelegraph,['ethereum'],[],9,30,15,ETH
2021-10-12 19:39:04 UTC,"Ethereum price has taken the back seat now that Bitcoin is basking in the limelight, but  says this hasn't changed bulls' belief that ETH will hit a new ATH before the year ends.  https://t.co/kwtCPzMYen",cointelegraph,[],[],17,63,6,ETH
2021-10-12 19:02:03 UTC,"The crypto exchange said the new marketplace would be based on Ethereum, which dominates sales in the NFT market... for now  https://t.co/FLFjLMdYot",cointelegraph,[],[],24,93,27,ETH
2021-10-12 17:22:01 UTC,"“In some ways, the number of critics matters much less than the strength of the supporters.” The co-founder of Ethereum,  spoke about DAOs, ETH, and NFTs in a recent interview.   https://t.co/B2yfnEqL8p",cointelegraph,[],[],19,90,18,ETH
2021-10-12 15:16:06 UTC,"Vitalik Buterin talks the Ethereum ecosystem, DAO's, Bitcoin and NFT's in conversation with The Stakeborg Talks . Story by   https://t.co/fz0PIWwkkf",cointelegraph,[],[],54,186,16,ETH
2021-10-12 14:44:01 UTC,"A stumbling block.   Despite a great start to Q4, the ETH/BTC exchange rate has fallen around 12% for the first time in over two months.   https://t.co/jC3HS8LFvA",cointelegraph,[],[],8,44,14,ETH
2021-10-12 12:56:03 UTC,Ethereum's value against Bitcoin dropped below its 200-day EMA for the first time since March 2020.  https://t.co/4KcZVrdFO3,cointelegraph,[],[],19,92,19,ETH
2021-10-12 11:15:02 UTC,"To determine where crypto goes next, it’s always best to talk to the experts.    of  provides her thoughts on ETH's future while revealing her ideal superpowers.  https://t.co/9t3xgBfPeJ",cointelegraph,[],[],12,37,24,ETH
2021-10-12 02:37:00 UTC,Ethereum is going to overtake Bitcoin at the top of Mount Crypto.   Find out why  co-founder  thinks ETH is going to outpace BTC.  https://t.co/Ss69SSRege,cointelegraph,[],[],46,242,47,ETH
2021-10-11 21:52:03 UTC,"Six-figure #Bitcoin? More likely than you think.   Last week on The Market Report, our special guest  had very interesting takes on Bitcoin, Ethereum, and crypto security.   Click here to watch more:  https://t.co/smsA6fxoDa  https://t.co/IZHZVO0ueG",cointelegraph,['bitcoin'],[],8,36,12,ETH
2021-10-10 23:30:00 UTC,"Vice president of research and development for MyEtherWallet, , thinks ETH will go to the moon.   Find out why in our recent  exclusive interview:  https://t.co/c0jyhjGMVd",cointelegraph,[],[],20,61,19,ETH
2021-10-10 05:00:00 UTC,"Earlier this week,  completed a $4 million financing round to accelerate development across multiple blockchains including Ethereum, Near, and Polkadot.  https://t.co/F3KM8LTFQX",cointelegraph,[],[],23,131,19,ETH
2021-10-09 23:30:00 UTC,"There are a lot of competitors in the NFT market, but will any challenge Ethereum?   New data shows the platform accounts for more than 97% of recent sales despite efforts by Flow, Polygon and WAX.  https://t.co/jJuS6VuynM  (Research via )",cointelegraph,[],[],23,74,18,ETH
2021-10-09 15:00:37 UTC,"Are miners the new hodlers?   ETH held by those that mine it hits $1.85 billion, the largest it has been since shortly after the network was launched in 2016.  https://t.co/Ok1D3cOQnk",cointelegraph,[],[],37,211,22,ETH
2021-10-09 01:52:01 UTC,Hong Kong is getting some sustainable BTC and ETH mining courtesy of Powercrypto Holdings.  https://t.co/jk4A5zuNDW,cointelegraph,[],[],26,96,10,ETH
2021-10-09 00:30:05 UTC,"There are a lot of competitors in the NFT market, but will any challenge Ethereum?   New data shows that the platform accounts for more than 97% of recent sales despite opposition from Flow, Polygon and WAX.  https://t.co/nElPjaKy0t  (Research via )  https://t.co/0kmiFBhqu1",cointelegraph,[],[],114,592,677,ETH
2021-10-08 23:52:01 UTC,Powercrypto Holdings is setting up BTC and ETH mining in Hong Kong using sustainable energy.  https://t.co/Wre828snq8,cointelegraph,[],[],26,91,9,ETH
2021-10-08 22:52:00 UTC,"Are miners the new hodlers?   The amount of ETH held by those that mine it hits $1.85 billion, the largest it has been since shortly after the network was launched in 2016.  https://t.co/5qkU3H077x",cointelegraph,[],[],14,45,6,ETH
2021-10-08 20:37:03 UTC,"There are a lot of competitors in the NFT market, but will any challenge Ethereum?   New data shows the platform accounts for more than 97% of recent sales despite opposition from Flow, Polygon and WAX.  https://t.co/YWYyd9dnsE  (Reporting via )  https://t.co/BrgCAbyZqJ",cointelegraph,[],[],10,47,6,ETH
2021-10-08 18:52:07 UTC,"No, that's mine!    BTC and ETH mining is coming to Hong Kong thanks to Powercrypto Holdings and they're looking to use sustainable energy.  https://t.co/ZX0ZE9INnW",cointelegraph,[],[],28,111,12,ETH
2021-10-08 18:15:01 UTC,"Could a drop on Ethereum be setting up for a bullish pump? An inverse head and shoulders pattern could see a new ETH high of $4,500 if everything lines up.  https://t.co/a52AdJq4wH",cointelegraph,[],[],32,92,9,ETH
2021-10-08 17:32:05 UTC,Powercrypto Holdings set to commence Bitcoin and Ethereum green-mining venture in Hong Kong. Story by   https://t.co/YRG3Vu4EsH,cointelegraph,[],[],12,49,8,ETH
2021-10-08 17:15:08 UTC,"Are miners the new hodlers?   ETH held by those that mine it reaches $1.85 billion, the largest it has been since shortly after the network was launched in 2016.  https://t.co/l00dnD2uvc",cointelegraph,[],[],12,66,13,ETH
2021-10-08 17:08:04 UTC,Ethereum could drop to $3.2K in the coming sessions as ETH paints a Rising Wedge pattern.  https://t.co/fiRhg0Z87C,cointelegraph,[],[],32,85,16,ETH
2021-10-08 14:52:02 UTC,"Did you miss The Market Report yesterday?  Our hosts , , and  were joined by  to discuss #Bitcoin's surge, #ETH's hammer candle, and crypto's security challenges.   Click the link to watch now!  https://t.co/VhACWWQAbx  https://t.co/hDqiBrE1Ib",cointelegraph,"['bitcoin', 'eth']",[],6,31,7,ETH
2021-10-08 14:30:24 UTC,"There are a lot of competitors in the NFT market, but can any challenge Ethereum?   New data shows the platform accounts for more than 97% of recent sales despite opposition from Flow, Polygon and WAX.  https://t.co/zHHR7FyxmM  (Reporting via )  https://t.co/WkdlvdPVvB",cointelegraph,[],[],10,37,10,ETH
2021-10-08 12:25:32 UTC,Is Ethereum losing steam in the NFT market? Our upcoming report from  will be diving into alternative blockchains and their possible rise to dominance.  https://t.co/Qo1KunrTm7,cointelegraph,[],[],12,37,16,ETH
2021-10-08 12:00:14 UTC,"Are miners the new hodlers?   The amount of ETH held by those that mine it reaches $1.85 billion, the largest it has been since shortly after the network was launched in 2016.  https://t.co/fEglN5JGO3",cointelegraph,[],[],8,50,14,ETH
2021-10-08 11:04:51 UTC,The  protocol automates Ethereum smart contract operations by using what it calls “arbitrary logic” and bots. Its most prominent use case is addressing liquidity and volatility issues with cryptocurrency trading.,cointelegraph,[],[],5,28,6,ETH
2021-10-08 09:26:02 UTC,"Bitkraft’s new token fund has mainly invested in #Ethereum blockchain-based startups but is now open to other chains including #Solana, senior associate Piers Kicks said.  https://t.co/TUwiZdcBpC",cointelegraph,"['ethereum', 'solana']",[],17,97,19,ETH
2021-10-08 04:54:03 UTC,"Ethereum miners hold $1.85 billion worth of ETH, and they’re not in a hurry to sell it. Are they holding out for higher prices?  https://t.co/zFC1KUjBsc",cointelegraph,[],[],29,141,15,ETH
2021-10-08 01:52:01 UTC,"Filet mignon-level backing for this crypto staking platform.    closes a $4 million financing round to accelerate development across multiple blockchains including Ethereum, Near, and Polkadot.  https://t.co/71M2qogtEH  (Reporting via )",cointelegraph,[],[],11,49,6,ETH
2021-10-08 00:00:10 UTC,ETH bears seem to be on the wrong end of the tug-of-war this week as $250M in options are likely to go to bulls on Friday's expiry.  https://t.co/uMuel6Ma2W,cointelegraph,[],[],17,82,10,ETH
2021-10-07 20:15:04 UTC,"Filet mignon-level backing for this crypto staking platform.    completes a $4 million financing round as it aims to accelerate development across multiple blockchains including Ethereum, Near, and Polkadot.  https://t.co/4Bs7Wi6sgS  (Reporting via )",cointelegraph,[],[],9,31,7,ETH
2021-10-07 19:15:03 UTC,ETH bears seem to be on the wrong end of the tug-of-war this week as $250M in options are likely to go to bulls after Friday's expiry.  https://t.co/dJIBOgrgeR,cointelegraph,[],[],28,94,13,ETH
2021-10-07 18:18:05 UTC,"Can ETH bears put up a miracle and suppress the price below $3,300 before Friday's expiry?  https://t.co/ed6mIxxumg",cointelegraph,[],[],14,47,10,ETH
2021-10-07 16:27:47 UTC,"Should people be worried about security in the crypto world?  There is always a security concern. Even though security is on the rise, as the price of #Bitcoin and #ETH increases, they will be targeted more and more. Store your crypto off of exchanges""-",cointelegraph,"['bitcoin', 'eth']",[],5,11,2,ETH
2021-10-07 16:25:20 UTC,"Do you believe in ETH killers?  ""I don't see any threat to Ethereum's dominance. We've been talking about it for years now, and it's still here. Solana is expanding, but can it take over Ethereum? Probably not.""-",cointelegraph,[],[],3,14,3,ETH
2021-10-07 16:18:55 UTC,"Are we cracking $5K for ETH soon?    feels bullish and says that it is incredibly possible, potentially even seeing $10K sooner than expected.  https://t.co/y9BSK8s4Je",cointelegraph,[],[],1,9,2,ETH
2021-10-07 16:15:13 UTC,"This week, we saw an Ethereum fractal from 2017 that resulted in 7,000% gains for ETH appear again in 2021. This could potentially send Ether's price all the way up to $13K in the next 6 months. What do you think?  https://t.co/VMwC2ZZFTg",cointelegraph,[],[],1,16,1,ETH
2021-10-07 16:03:42 UTC,Poll time!   Do you think ETH will crack $5K by the end of the year?,cointelegraph,[],[],2,11,9,ETH
2021-10-07 15:30:07 UTC,"Filet mignon-level backing for this crypto staking platform.    completes a $4 million financing round to accelerate development across multiple blockchains including Ethereum, Near, and Polkadot.  https://t.co/l7ZcyjG9es  (Reporting via )",cointelegraph,[],[],20,104,12,ETH
2021-10-06 21:15:00 UTC,Are you ready to begin your decentralized blogging career?   Ethereum-based platform  opens publishing access to the public after previously running vote-based contributions exclusively.  https://t.co/dYtfzsoB45,cointelegraph,[],[],8,37,9,ETH
2021-10-06 17:48:04 UTC,"If Bitcoin sustains above $52,920, the momentum could boost Ethereum, Cardano, XRP, Polkadot, and other altcoins with it.  https://t.co/ffyW0HofuR",cointelegraph,[],[],97,382,38,ETH
2021-10-06 17:06:03 UTC,"The least resistant path for BTC and ETH are higher in Q4, according to Bloomberg's senior commodity strategist Mike McGlone  https://t.co/4ToxlyNxHj",cointelegraph,[],[],11,53,8,ETH
2021-10-06 16:01:26 UTC,Is decentralized blogging the future of writing?   Ethereum-based platform  opens publishing access to the public after previously running vote-based contributions exclusively.  https://t.co/HO2uaoC4BV,cointelegraph,[],[],12,53,10,ETH
2021-10-06 13:27:32 UTC,"We're getting more than candy this October!   Ethereum hits $3,500 as ""Pumptober"" is already living up to expectations.  https://t.co/t1tZ89ceVb",cointelegraph,[],[],100,481,24,ETH
2021-10-06 11:00:19 UTC,Are you ready to enter the world of decentralized blogging?   Ethereum-based platform  opens publishing access to the public after previously running vote-based contributions exclusively.  https://t.co/RUvs3OqCOK,cointelegraph,[],[],8,61,11,ETH
2021-10-06 05:05:32 UTC,"Shark Tank's Kevin O’Leary is backing Bitcoin, Ethereum and Solana and plans to up his portfolio allocation to 7% crypto by the end of this year.  https://t.co/l6VlGgpyD2",cointelegraph,[],[],114,530,35,ETH
2021-10-05 04:00:33 UTC,"Morgan Stanley doubles its Bitcoin exposure, Doge co-founder eying Ethereum bridge, and the largest bounty in DeFi history.  https://t.co/9MgUTPQEUp",cointelegraph,[],[],73,243,8,ETH
2021-10-05 02:15:01 UTC,"After suffering an attack,  is getting a helping hand from  to recover more than $16M of its lost funds. Cream Finance suffered a flash loan attack to the tune of $19 million in ETH and Amp tokens back in August.  https://t.co/LhHpw33Lh2",cointelegraph,[],[],12,29,6,ETH
2021-10-04 23:45:01 UTC,"Doge co-founder eying Ethereum bridge, Morgan Stanley doubles its Bitcoin exposure, and the largest bounty in DeFi history.  https://t.co/3iBqrJDjc0",cointelegraph,[],[],26,119,11,ETH
2021-10-03 22:00:00 UTC,"In a coincidental Deja Vu, patterns and fractals show ETH could hit $13,000 in the next six months.  Will history repeat itself?  https://t.co/QfYRWk7vrH",cointelegraph,[],[],73,325,29,ETH
2021-10-03 12:23:32 UTC,"Ethereum can hit $13,000 in 6 months if this historic fractal repeats.  https://t.co/wrP3Jm8Sjm",cointelegraph,[],[],193,824,58,ETH
2021-10-02 23:30:09 UTC,"Doge co-founder eying Ethereum bridge, Morgan Stanley doubles its Bitcoin exposure, and the largest bounty in DeFi history. Check out our  top stories of the week!  https://t.co/59ECLfL0qK",cointelegraph,[],[],30,114,11,ETH
2021-10-02 23:17:03 UTC,"Many traders are uber bullish on ETH but avoid futures because of the liquidation risk.  explains how the Iron Condor options strategy gives cautious traders ""safe"" exposure to Ethereum.  https://t.co/cS7KGH16vJ",cointelegraph,[],[],10,38,13,ETH
2021-10-02 12:00:08 UTC,Next stop: the moon?   Dogecoin co-founder  has his sights set on NFTs and an Ethereum-to-Dogecoin bridge to help bring about mass adoption.  https://t.co/z9cq1bvcMR,cointelegraph,[],[],79,316,94,ETH
2021-10-02 07:16:33 UTC,"Solana and Uniswap now make the top 5 assets in Grayscale's diversified GDLC portfolio after Bitcoin, Ethereum and Cardano.  https://t.co/uIqASgEedj",cointelegraph,[],[],134,702,44,ETH
2021-10-02 03:45:00 UTC,Ethereum is using the rising inflation in the US to its advantage. The altcoin seems to be on its way to doubling its market value in the next months.  Will ETH make it all the way up by the end of Q4?  https://t.co/NBDsLQ2kNv,cointelegraph,[],[],107,472,37,ETH
2021-10-01 21:45:05 UTC,Umbrella Network made its Ethereum debut today and the oracle service is ready to bridge Ethereum and Binance Smart Chain for cross-chain transactions.  https://t.co/OVRs3J0vQf,cointelegraph,[],[],10,65,14,ETH
2021-10-01 20:30:01 UTC,Next stop: the moon?   Dogecoin co-founder  sets his sights on NFTs and an Ethereum-to-Dogecoin bridge to help bring about mass adoption.  https://t.co/cXcjJVOubI,cointelegraph,[],[],20,75,9,ETH
2021-10-01 19:52:01 UTC,"ETH might double its market value in the coming months.  With the rising inflation in the US, the altcoin might go all the way up in the last quarter of 2021.  https://t.co/NfsoDKoRI9",cointelegraph,[],[],55,316,21,ETH
2021-10-01 17:15:02 UTC,Wouldn't transaction straight from Ethereum to Binance Smart Chain be cool? Umbrella Network thinks so too.   The decentralized oracle service Umbrella Network launched on Ethereum and is laying the foundation for cross-network transactions.    https://t.co/sWJvoPgVij,cointelegraph,[],[],15,62,11,ETH
2021-10-01 17:05:32 UTC,"Ethereum follows Bitcoin with 9% gains to cross $3,000.  https://t.co/53zYHQt0JN",cointelegraph,[],[],34,162,10,ETH
2021-10-01 16:15:00 UTC,Next stop: the moon?   Dogecoin co-founder  has set his sights on NFTs and an Ethereum-to-Dogecoin bridge to help bring about mass adoption.  https://t.co/0X8GuFeueG,cointelegraph,[],[],26,115,14,ETH
2021-10-01 16:13:03 UTC,The Enterprise Ethereum Alliance’s AMA on regulations and the infrastructure bill shed light on how new legislation may impact the DeFi ecosystem and crypto community at large  https://t.co/UknDx9KOur,cointelegraph,[],[],13,44,7,ETH
2021-10-01 10:30:17 UTC,Is this DOGE’s pathway to the moon?   Dogecoin co-founder  has set his sights on NFTs and an Ethereum-to-Dogecoin bridge to help bring about mass adoption.  https://t.co/seZ2ETMVw0,cointelegraph,[],[],25,81,13,ETH
2021-10-01 02:03:03 UTC,"Dogecoin co-founder Billy Markus has emphasized the importance of completing a Dogecoin-to-Ethereum bridge, as it would enable NFT purchases with DOGE and ramp up adoption.  https://t.co/BN7diFLJam",cointelegraph,[],[],52,221,26,ETH
2021-10-01 00:52:01 UTC,"Ethereum options expire every week, and this Friday's expiry has bears looking to move with price action. Take a look at what traders are seeing with the upcoming $340M options expiry.  https://t.co/XmFJWn8CJx",cointelegraph,[],[],17,56,9,ETH
2021-09-30 22:00:00 UTC,Is  ready to break away from the pack?  The layer-two aggregator sees a 330% surge in daily active unique addresses over the past three months and briefly surpasses layer one Ethereum for the first time.  https://t.co/gHK1eZYxp3,cointelegraph,[],[],32,144,7,ETH
2021-09-30 21:15:03 UTC,"Ethereum miners continued to accumulate ETH even after revenue scares from the network's London hard fork.  An on-chain study showed miners accumulated 2M Ether, worth over $6B, since the London hard fork on August 5th.  https://t.co/iBjF3m4ZrL",cointelegraph,[],[],10,42,9,ETH
2021-09-30 17:30:21 UTC,"Alright traders, this is what the landscape is looking like heading into Friday's $340M weekly ETH options expiry.  https://t.co/p0YA6U3ftw",cointelegraph,[],[],16,51,12,ETH
2021-09-30 17:22:01 UTC,Is  ready to rocket?  The layer two aggregator saw a 330% surge in daily active unique addresses over the past three months and briefly surpasses layer one Ethereum for the first time.  https://t.co/Kanhx7YjqE,cointelegraph,[],[],227,937,79,ETH
2021-09-30 17:01:52 UTC,"Instead of traders in China selling their crypto for fiat, there's been an exodus of ETH, stablecoins, and other tokens off of exchanges and into DeFi.  https://t.co/gqnJeAU0MT",cointelegraph,[],[],4,16,3,ETH
2021-09-30 17:01:03 UTC,"After the Ethereum network was upgraded, miners were faced with the possibility of less revenue.   But an on-chain study by  intelligence showed ETH miners still accumulated 2M Ether, worth over $6B, since the London hard fork on August 5th.  https://t.co/8sH5u95YsH",cointelegraph,[],[],22,62,13,ETH
2021-09-30 16:34:34 UTC,"The $3,000 level is proving to be a tough resistance for ETH bulls to overcome, and  says there are good reasons for bears to suppress the price ahead of Friday’s $340 million options expiry.  https://t.co/5IhTl0ygen",cointelegraph,[],[],8,36,7,ETH
2021-09-30 13:47:33 UTC,"Ethereum miners' ETH holdings have reached almost $70 billion, a new all-time high.  https://t.co/7lfLgRHt8x",cointelegraph,[],[],41,193,19,ETH
2021-09-30 12:00:11 UTC,Ignore  at your own peril.   The layer two aggregator saw a 330% surge in daily active unique addresses over the past three months and briefly surpasses layer one Ethereum for the first time.  https://t.co/coV2Unip3S,cointelegraph,[],[],138,498,37,ETH
2021-09-30 05:02:32 UTC,Polygon usage and adoption have skyrocketed recently as users scramble to avoid Ethereum’s painful gas fees.  https://t.co/uTxLpIs1pk,cointelegraph,[],[],71,276,18,ETH
