created_at,tweet,username,hashtags,cashtags,retweets_count,likes_count,replies_count,coin
2021-11-09 08:43:20 UTC,At this stage just being able to afford to use #ethereum is a flex,thecryptolark,['ethereum'],[],170,2742,207,ETH
2021-11-09 07:55:25 UTC,"Meta mask will likely do a token, potentially soon. Probably going to people who used the in app swap feature IMO. #ethereum",thecryptolark,['ethereum'],[],76,1046,126,ETH
2021-11-09 02:41:23 UTC,"yeah, Eth is struggling, slow and expensive. Can't wait for 2.0",thecryptolark,[],[],0,5,0,ETH
2021-11-08 22:04:04 UTC,That is INSANE man!!!! #ethereum   https://t.co/VZMypGZcMm,thecryptolark,['ethereum'],[],75,614,60,ETH
2021-11-08 20:43:53 UTC,"New #ethereum all time high at $4,803!!!  When 5k?",thecryptolark,['ethereum'],[],226,3922,277,ETH
2021-11-08 20:31:00 UTC,"Trade #bitcoin￼ #ethereum #cardano and all the top #crypto #altcoins on Phemex.  Use this link to sign up and get 10% off fees and up to $1,200 trading bonus! $100 standard bonus  $1,100 deposit bonus  https://t.co/TbdGKgOTUq",thecryptolark,"['bitcoin', 'ethereum', 'cardano', 'crypto', 'altcoins']",[],9,65,29,ETH
2021-11-08 01:25:59 UTC,"Holy crap!!!!! #ethereum is at $4,700!!!!!!",thecryptolark,['ethereum'],[],248,3895,192,ETH
2021-11-07 22:16:37 UTC,Will the bull run end before #ethereum 2.0 comes out next year?,thecryptolark,['ethereum'],[],84,1619,390,ETH
2021-11-07 05:29:00 UTC,Would you rather have 1 #bitcoin or 14.5 #ethereum (equivalent to 1 BTC)?,thecryptolark,"['bitcoin', 'ethereum']",[],284,4287,2295,ETH
2021-11-07 03:59:00 UTC,"Will #ethereum hit $10,000 by the end of year?   No Way            I Hope            Hell Yeah 👇                      👇                       👇",thecryptolark,['ethereum'],[],664,11004,857,ETH
2021-11-06 22:10:00 UTC,"Want to earn a super easy passive #crypto income?   Then check out Celsius!   Earn 6.2% #bitcoin, 5.35% #ethereum, 8.88% USDC, (great rates on altcoins too)  Use this link to get $50 by using promo code LARK or referral code 1825690ce9  https://t.co/K6HFhYGCu4",thecryptolark,"['crypto', 'bitcoin', 'ethereum']",[],29,215,63,ETH
2021-11-06 00:25:00 UTC,If #ethereum flips #bitcoin does that mean the 4 year halving cycles as a key driver of the market no longer matter?,thecryptolark,"['ethereum', 'bitcoin']",[],87,1429,286,ETH
2021-11-05 22:10:00 UTC,"Trade #bitcoin #ethereum #cardano and all the top #crypto #altcoins on Phemex.  Use this link to sign up and get 10% off fees and up to $1,200 trading bonus! $100 standard bonus  $1,100 deposit bonus  https://t.co/TbdGKh6vj0",thecryptolark,"['bitcoin', 'ethereum', 'cardano', 'crypto', 'altcoins']",[],9,89,27,ETH
2021-11-05 19:10:00 UTC,What are your top 5 #crypto holdings?   Mine are  #bitcoin  #ethereum  $usdc $egld  $matic,thecryptolark,"['crypto', 'bitcoin', 'ethereum']","['usdc', 'egld', 'matic']",290,2972,1764,ETH
2021-11-05 07:33:00 UTC,"Burger King giving away #crypto to 2,000,0220 people!   #bitcoin #ethereum and #dogecoin   Probably the biggest crypto giveaway ever by number of new users it will on board",thecryptolark,"['crypto', 'bitcoin', 'ethereum', 'dogecoin']",[],183,1660,173,ETH
2021-11-05 03:21:00 UTC,"#ethereum addresses with at least 0.1 ETH at an ATH, bullish! Currently over 6 million addresses  https://t.co/Ohk8ldpQxK",thecryptolark,['ethereum'],[],55,576,43,ETH
2021-11-05 00:29:58 UTC,"By not using ETH, there are like 20 other blockchains",thecryptolark,[],[],0,0,2,ETH
2021-11-05 00:28:04 UTC,"Have you used BSC, Polygon, Solana, or Avalanche? Why only use Ethereum?",thecryptolark,[],[],0,106,14,ETH
2021-11-04 02:08:31 UTC,If you are using #ethereum based applications then check to see if it can be used on layer 2. Many popular ones like Curve Finance and Uniswap can be used on Arbitrum.,thecryptolark,['ethereum'],[],42,484,248,ETH
2021-11-04 02:05:49 UTC,"If you use #Ethereum and your transaction is not super urgent, then this tool can help you find the times when gas fees tend to be the lowest   https://t.co/qEcd45MxfJ",thecryptolark,['ethereum'],[],80,384,62,ETH
2021-11-04 01:57:54 UTC,"#ethereum fees are generally stomach churning right now, so why do people keep paying it? Because people who can afford it want access to the #defi and #NFTs on ETH",thecryptolark,"['ethereum', 'defi', 'nfts']",[],99,1460,279,ETH
2021-11-04 01:29:47 UTC,Users are flooding to chains like #solana and #avalanche because of the absurd fee situation on #ethereum right now.,thecryptolark,"['solana', 'avalanche', 'ethereum']",[],359,3983,601,ETH
2021-11-03 07:29:00 UTC,"There is now almost 5 billion on layer two #ethereum. This will probably 20X over the next year as people realize that they can just go and use L2 now, and when exchanges enable direct L2 withdrawals",thecryptolark,['ethereum'],[],102,1122,131,ETH
2021-11-03 05:23:00 UTC,"More than 100,000 #ethereum were burned last week... wow, just wow!",thecryptolark,['ethereum'],[],130,1865,150,ETH
2021-11-03 03:31:00 UTC,"#crypto pumping like crazy, #ethereum new ATH, #solana new ATH, Australian bank getting into BTC, and $shib whale is not dead  Check it out  👇  https://t.co/3yNdL3vxKH",thecryptolark,"['crypto', 'ethereum', 'solana']",['shib'],28,472,68,ETH
2021-11-02 22:42:23 UTC,"$8,000 #ethereum by the end of the year? Do you think they are right?   https://t.co/FfIXQoYaF1",thecryptolark,['ethereum'],[],70,788,239,ETH
2021-11-02 21:12:11 UTC,"#ethereum got over $4,500 today, insanity!",thecryptolark,['ethereum'],[],122,2204,231,ETH
2021-11-02 10:49:28 UTC,#ethereum getting ready to run to 5k?,thecryptolark,['ethereum'],[],125,2200,153,ETH
2021-11-02 10:35:14 UTC,"Oh hello #ethereum, what are you doing over there…",thecryptolark,['ethereum'],[],41,952,72,ETH
2021-11-02 03:48:34 UTC,#ethereum layer one has become the domain of rich users only. Thankfully ETH layer two is cheap to use and has a good user experience. However this is a huge opportunity for other chains to pick up users. #avalanche #solana $dot,thecryptolark,"['ethereum', 'avalanche', 'solana']",['dot'],119,1504,256,ETH
2021-11-01 22:07:00 UTC,"Want to earn a super easy passive #crypto income?   Then check out Celsius!   Earn 6.2% #bitcoin, 5.35% #ethereum, 8.88% USDC, (great rates on altcoins too)  Use this link to get $50 by using promo code LARK or referral code 1825690ce9  https://t.co/K6HFhYGCu4",thecryptolark,"['crypto', 'bitcoin', 'ethereum']",[],17,118,36,ETH
2021-11-01 07:45:40 UTC,"#ethereum just had a week of negative issuance, and the triple halving hasn’t even happened yet!",thecryptolark,['ethereum'],[],143,2282,200,ETH
2021-11-01 00:24:31 UTC,An Ethereum based token ;),thecryptolark,[],[],0,7,0,ETH
2021-10-31 23:40:03 UTC,"I was talking about withdrawing USDC to Solana, not Ethereum. Most exchanges do not offer that option, which is why if using Voyager you will need to take Solana to your Phantom wallet and then swap for what you want.",thecryptolark,[],[],0,5,3,ETH
2021-10-31 23:05:28 UTC,"Then don't use Ethereum dude, soooooooooo many other options out. Use BSC, Polygon, Solana, Fantom, Avalanche, all dirt cheap to use.",thecryptolark,[],[],2,57,5,ETH
2021-10-31 23:03:21 UTC,"Then use Pancake on BSC, Raydium on Solana, or the other dozens of options across other chains and ETH layers twos",thecryptolark,[],[],1,19,1,ETH
2021-10-31 23:02:14 UTC,"#ethereum remains under valued at its current price, $10,000 is inevitable!    https://t.co/uz6M8PIUmY",thecryptolark,['ethereum'],[],68,809,94,ETH
2021-10-31 22:06:00 UTC,"Trade #Bitcoin #ethereum #cardano and all the top #crypto #altcoins on Phemex.  Use this link to sign up and get 10% off fees and up to $1,200 trading bonus! $100 standard bonus  $1,100 deposit bonus  https://t.co/TbdGKh6vj0",thecryptolark,"['bitcoin', 'ethereum', 'cardano', 'crypto', 'altcoins']",[],14,85,44,ETH
2021-10-30 06:46:00 UTC,Would you rather have 1 #ethereum or an #nft worth 1 Ethereum?,thecryptolark,"['ethereum', 'nft']",[],179,2414,1157,ETH
2021-10-30 05:00:00 UTC,1 #bitcoin = 1 Bitcoin  1 #ethereum = 1 Ethereum  1 $doge = 1 doge  Your understanding of this will determine your fate in this market,thecryptolark,"['bitcoin', 'ethereum']",['doge'],121,1321,196,ETH
2021-10-29 23:07:00 UTC,"Want to earn a super easy passive #crypto income?   Then check out Celsius!   Earn 6.2% #bitcoin, 5.35% #ethereum, 8.88% USDC, (great rates on altcoins too)  Use this link to get $50 by using promo code LARK or referral code 1825690ce9  https://t.co/K6HFhYYdSE",thecryptolark,"['crypto', 'bitcoin', 'ethereum']",[],17,159,69,ETH
2021-10-29 19:00:01 UTC,Can #ethereum ever flip #bitcoin?,thecryptolark,"['ethereum', 'bitcoin']",[],114,2241,597,ETH
2021-10-29 08:16:17 UTC,You remember back in the day when you could buy a whole #ethereum for under $200???   Those were good times,thecryptolark,['ethereum'],[],160,3501,471,ETH
2021-10-29 07:42:00 UTC,"$10,000 #ethereum  $100,000 #bitcoin   These prices are programmed in for the end of the year",thecryptolark,"['ethereum', 'bitcoin']",[],400,3984,333,ETH
2021-10-29 06:21:49 UTC,"So #ethereum going to $5,000 in the next few days?",thecryptolark,['ethereum'],[],139,2676,195,ETH
2021-10-29 04:41:27 UTC,"I love #ethereum, but the current fee situation is absurd. Layer twos are a big step in the right direction, proof of stake coming soon, but today, ouch.",thecryptolark,['ethereum'],[],93,1663,252,ETH
2021-10-29 04:40:07 UTC,"Trash ETH? Sorry I love ETH, but I am just being real. $200 to do a swap is unaffordable for most people.",thecryptolark,[],[],0,1,0,ETH
2021-10-29 04:31:28 UTC,"While #ethereum fees are crushing, and to be honest completely inaccessible for non rich users #solana #avalanche #BSC and #polygon all offer dirt cheap fees and a good user experience!",thecryptolark,"['ethereum', 'solana', 'avalanche', 'bsc', 'polygon']",[],83,1221,184,ETH
2021-10-29 04:09:23 UTC,Costs almost $200 to use Uniswap right now... #ethereum,thecryptolark,['ethereum'],[],151,2285,494,ETH
2021-10-29 02:52:14 UTC,"The goal used to be to get 1 #bitcoin, but for most people that is just a dream now. Soon owning 1 #ethereum will also be out of reach. Tick tock...",thecryptolark,"['bitcoin', 'ethereum']",[],246,2842,153,ETH
2021-10-29 02:06:46 UTC,"New #ethereum all time high at $4,416.05 🥳🥳🥳",thecryptolark,['ethereum'],[],250,3037,99,ETH
2021-10-28 22:06:00 UTC,"Trade #bitcoin￼ #ethereum #cardano and all the top #crypto #altcoins on Phemex.  Use this link to sign up and get 10% off fees and up to $1,200 trading bonus! $100 standard bonus  $1,100 deposit bonus  https://t.co/TbdGKh6vj0",thecryptolark,"['bitcoin', 'ethereum', 'cardano', 'crypto', 'altcoins']",[],5,58,32,ETH
2021-10-27 01:44:27 UTC,"We can also add in here the explosion of Ethereum layer two adoption with Optimism, Arbitrum, Polygon, Starkware, and ImmutableX, among others.   Don't fade ETH, this bad boy is going to 5 digits.",thecryptolark,[],[],27,335,26,ETH
2021-10-27 01:44:26 UTC,"Consider all of that use and demand, and then factor in the move to proof of stake soon. The move to POS will give ETH an annual negative supply rate of -2%.   M O O N that spells moon   https://t.co/QjHbo6WvYC",thecryptolark,[],[],21,260,12,ETH
2021-10-27 01:44:26 UTC,"More and more institutional investors are choosing to buy Ethereum, sometimes instead of Bitcoin, sometimes along with it. This crowd represents hundreds of trillions in capital.    https://t.co/dR6NvBQj9n",thecryptolark,[],[],16,112,5,ETH
2021-10-27 01:44:25 UTC,"Bitcoin ETFs have finally been approved in the USA, which means that Ethereum ETFs will be coming soon. Yes, we still want spot ETFs not futures ETFs, but it will be a big step forward for ETH regardless.    https://t.co/BC88X5Ko0F",thecryptolark,[],[],8,114,6,ETH
2021-10-27 01:44:25 UTC,"Facebook with its 2.8 billion monthly active users just launched its crypto wallet called Novi which allows for stablecoin transfers... on Ethereum! Still just a pilot, but huge implications!    https://t.co/YUEYuq2rvo",thecryptolark,[],[],9,122,2,ETH
2021-10-27 01:44:24 UTC,"Tik Tok with its billion plus monthly active users just launched NFTs on the platform, their chose blockchain? Ethereum   https://t.co/Yog0xaUXts",thecryptolark,[],[],9,118,5,ETH
2021-10-27 01:44:24 UTC,Twitter with its 330 million monthly active users has enabled Ethereum based verification for profile picture NFTs and has further Ethereum based NFT ambitions in the works.    https://t.co/2ifSISGziz,thecryptolark,[],[],15,131,5,ETH
2021-10-27 01:44:23 UTC,"Reddit with its 430 million monthly active users launched community tokens on Ethereum last year, and this week they announced that they are building an #NFT platform!    https://t.co/jNU5GCpakE",thecryptolark,['nft'],[],8,135,5,ETH
2021-10-27 01:44:23 UTC,#ethereum remains massively undervalued especially when you understand the insane fundamentals of what is happening to this asset!   Thread 👇,thecryptolark,['ethereum'],[],242,1901,134,ETH
2021-10-27 00:18:33 UTC,"After proof of stake comes online for #ethereum, ETH will have an annual 2% supply drop 🤯",thecryptolark,['ethereum'],[],112,1678,123,ETH
2021-10-26 22:16:07 UTC,Total value locked in #defi on #ethereum has snuck over 160 billion!  https://t.co/DMu6rcWZif,thecryptolark,"['defi', 'ethereum']",[],24,272,30,ETH
2021-10-26 08:00:29 UTC,In a few years owning 1 #ethereum will be out of reach for most investors,thecryptolark,['ethereum'],[],366,4384,362,ETH
2021-10-25 21:16:00 UTC,"Want to earn a super easy passive #crypto income?   Then check out Celsius!   Earn 6.2% #bitcoin, 5.35% #ethereum, 8.88% USDC, (great rates on altcoins too)  Use this link to get $50 by using promo code LARK or referral code 1825690ce9  https://t.co/K6HFhYGCu4",thecryptolark,"['crypto', 'bitcoin', 'ethereum']",[],22,153,37,ETH
2021-10-25 00:52:11 UTC,#Ethereum highest weekly close to date  https://t.co/e5PN5CQ23x,thecryptolark,['ethereum'],[],234,2663,120,ETH
2021-10-24 20:15:00 UTC,"Trade #bitcoin￼ #ethereum #cardano and all the top #crypto #altcoins on Phemex.  Use this link to sign up and get 10% off fees and up to $1,200 trading bonus! $100 standard bonus  $1,100 deposit bonus  https://t.co/TbdGKgOTUq",thecryptolark,"['bitcoin', 'ethereum', 'cardano', 'crypto', 'altcoins']",[],29,150,211,ETH
2021-10-24 07:36:00 UTC,"My favorite portfolio mid cap #cryptos  $movr is basically #ethereum on Kusama $cvx is a #defi beast coin, good farms $gro stablecoin yields, sick farming $inj cross chain #defi market $toke is a #defi liquidity beast, great farming $wild is a hot #NFT metaverse  How about you?",thecryptolark,"['cryptos', 'ethereum', 'defi', 'defi', 'defi', 'nft']","['movr', 'cvx', 'gro', 'inj', 'toke', 'wild']",311,1868,950,ETH
2021-10-23 20:54:26 UTC,Ok #ethereum your turn to hit new all time highs now,thecryptolark,['ethereum'],[],154,2853,141,ETH
2021-10-23 09:50:29 UTC,"Over 600,000 #ethereum burnt due to eip1559 🔥🔥🔥🔥",thecryptolark,['ethereum'],[],174,2482,187,ETH
2021-10-22 21:45:00 UTC,"This year I have used  #Bitcoin  #ethereum (Most used) #solana #avalanche #polygon #BSC  #arbitrum #kusama   Probably missing something, but how about you, what chains have you used this year and which you do you use the most?",thecryptolark,"['bitcoin', 'ethereum', 'solana', 'avalanche', 'polygon', 'bsc', 'arbitrum', 'kusama']",[],57,707,553,ETH
2021-10-22 21:39:34 UTC,Reddit #nft platform coming! Built on #ethereum of course,thecryptolark,"['nft', 'ethereum']",[],28,220,32,ETH
2021-10-22 21:16:00 UTC,"Want to earn a super easy passive #crypto income?   Then check out Celsius!   Earn 6.2% #bitcoin, 5.35% #ethereum, 8.88% USDC, (great rates on altcoins too)  Use this link to get $50 by using promo code LARK or referral code 1825690ce9  https://t.co/K6HFhYGCu4",thecryptolark,"['crypto', 'bitcoin', 'ethereum']",[],19,144,43,ETH
2021-10-21 22:51:31 UTC,"Pension funds buying #bitcoin and #ethereum, in total US pension funds have 8.6 trillion, OECD 34 trillion.   Even a few percent of that money coming in will change the game big time!!!    https://t.co/glaWK2ou37",thecryptolark,"['bitcoin', 'ethereum']",[],95,547,32,ETH
2021-10-21 21:15:00 UTC,"Trade #bitcoin￼ #ethereum #cardano and all the top #crypto #altcoins on Phemex.  Use this link to sign up and get 10% off fees and up to $1,200 trading bonus! $100 standard bonus  $1,100 deposit bonus  https://t.co/TbdGKgOTUq",thecryptolark,"['bitcoin', 'ethereum', 'cardano', 'crypto', 'altcoins']",[],12,68,43,ETH
2021-10-21 01:09:51 UTC,"Wealth Mastery issue #68 out now!   This issue -  #ethereum fixed income - Deep dive on $gro  -  $icx interview - #crypto bridges -  #bitcoin TA - Token sales, airdrops, portfolio updates and more  Become a member today  https://t.co/zCSVr5zxoo",thecryptolark,"['ethereum', 'crypto', 'bitcoin']","['gro', 'icx']",7,92,20,ETH
2021-10-20 22:29:25 UTC,When #ethereum new all time high?,thecryptolark,['ethereum'],[],58,1470,165,ETH
2021-10-20 19:47:31 UTC,"Oh hello $4,000 #ethereum!   Nice to see you  again",thecryptolark,['ethereum'],[],55,1129,42,ETH
2021-10-20 09:13:35 UTC,"Facebook, Reddit, Twitter and Tik Tok are all using #ethereum…  Seriously wtf is going on in 2021?  How is anyone not bullish?",thecryptolark,['ethereum'],[],371,3479,220,ETH
2021-10-19 22:43:22 UTC,Tik Tok tweeting about #NFTs being sold for truck loads of #ethereum,thecryptolark,"['nfts', 'ethereum']",[],13,198,19,ETH
2021-10-19 04:46:02 UTC,"The Merge to proof of stake for #ethereum will be HUGE! $10,000 ETH coming.",thecryptolark,['ethereum'],[],228,2619,228,ETH
2021-10-19 00:37:37 UTC,"My #bitcoin and #ethereum are slow chill wealth storage plays, I make my real money with #altcoins",thecryptolark,"['bitcoin', 'ethereum', 'altcoins']",[],244,3507,302,ETH
2021-10-18 21:39:00 UTC,"Want to earn a super easy passive #crypto income?   Then check out Celsius!   Earn 6.2% #bitcoin, 5.35% #ethereum, 8.88% USDC, (great rates on altcoins too)  Use this link to get $50 by using promo code LARK or referral code 1825690ce9  https://t.co/K6HFhYGCu4",thecryptolark,"['crypto', 'bitcoin', 'ethereum']",[],17,201,61,ETH
2021-10-18 03:53:33 UTC,Coins I am currently farming with my #crypto stablecoins  #ethereum based: $cvx 39% APY $toke 25% $gro 826%  #solana based: $mer 22%  I am earning yield on stables on  Celsius 8.88% Anchor 19.5%  What are you farming with stables?  Shill below Down pointing backhand index,thecryptolark,"['crypto', 'ethereum', 'solana']","['cvx', 'toke', 'gro', 'mer']",138,1041,271,ETH
2021-10-17 21:41:00 UTC,"Trade #bitcoin￼ #ethereum #cardano and all the top #crypto #altcoins on Phemex.  Use this link to sign up and get 10% off fees and up to $1,200 trading bonus! $100 standard bonus  $1,100 deposit bonus  https://t.co/TbdGKgOTUq",thecryptolark,"['bitcoin', 'ethereum', 'cardano', 'crypto', 'altcoins']",[],14,79,77,ETH
2021-10-16 08:53:10 UTC,"#ethereum already pumping, just wait until they announce the ETH ETFs!!!",thecryptolark,['ethereum'],[],308,3784,190,ETH
2021-10-16 08:41:44 UTC,#bitcoin 4% from all time high and #ethereum 10%!!!! 😎🚀,thecryptolark,"['bitcoin', 'ethereum']",[],185,2411,137,ETH
2021-10-15 22:07:37 UTC,#bitcoin to 100k and #ethereum to 10k,thecryptolark,"['bitcoin', 'ethereum']",[],511,5748,392,ETH
2021-10-15 20:39:00 UTC,"Want to earn a super easy passive #crypto income?   Then check out Celsius!   Earn 6.2% #bitcoin, 5.35% #ethereum, 8.88% USDC, (great rates on altcoins too)  Use this link to get $50 by using promo code LARK or referral code 1825690ce9  https://t.co/K6HFhYGCu4",thecryptolark,"['crypto', 'bitcoin', 'ethereum']",[],28,166,40,ETH
2021-10-15 02:43:49 UTC,"First comes the #bitcoin ETF, then the #ethereum ETF, bullish!!!!",thecryptolark,"['bitcoin', 'ethereum']",[],128,1999,69,ETH
2021-10-14 04:20:04 UTC,"Do you agree with Mark Cuban about #ethereum or is there another #crypto coin that you think has ""the most upside""?   https://t.co/oLp3Ad8cVa",thecryptolark,"['ethereum', 'crypto']",[],58,625,340,ETH
2021-10-14 04:08:22 UTC,"#ethereum 16% away from all time high, $10,000 still in play for this market cycle",thecryptolark,['ethereum'],[],217,3254,167,ETH
2021-10-14 02:13:11 UTC,New all time highs can come real fast at this point! Will catch a lot of people on the sidelines!  Me personally?   Balls deep  #bitcoin #ethereum #crypto  https://t.co/mcIQcGGyyW,thecryptolark,"['bitcoin', 'ethereum', 'crypto']",[],46,551,46,ETH
2021-10-13 02:43:05 UTC,"Well..... technically via Maker Dao, but it was wrapped BTC on Ethereum",thecryptolark,[],[],0,3,1,ETH
2021-10-13 02:41:45 UTC,Ethereum Convex Finance and Maker Dao Solana claiming rewards on Mercurial  Avalance Wonderland and Trader Joe BSC Pancake Swap,thecryptolark,[],[],0,13,2,ETH
2021-10-13 02:17:25 UTC,"Ethereum pretty quick most of the time albeit expensive, other networks dirt cheap and almost instant",thecryptolark,[],[],0,17,3,ETH
2021-10-13 02:13:09 UTC,"Today I have used #ethereum, #solana, #avalanche, and #BSC   The future of #crypto is multi chain, and there are opportunities everywhere!",thecryptolark,"['ethereum', 'solana', 'avalanche', 'bsc', 'crypto']",[],149,1604,532,ETH
2021-10-12 04:11:18 UTC,"Did a bunch of #defi stuff on #ethereum today, I think I need a beer after paying all those insane gas fees...",thecryptolark,"['defi', 'ethereum']",[],63,1568,286,ETH
2021-10-12 01:30:12 UTC,"You can sell for Bitcoin, ETH, gold, stablecoins coins, property, etc. The choice is individual. You can be a true believer and sell high and rebuy low.",thecryptolark,[],[],0,6,2,ETH
2021-10-11 23:36:08 UTC,"Been using Solana defi quite a bit recently, but reality is that a lot of the products I want to use are on layer one #ethereum, just have to suck it up and pay the fees.",thecryptolark,['ethereum'],[],31,604,99,ETH
2021-10-11 23:35:20 UTC,$250 to make a trade on Uniswap right now... #ethereum,thecryptolark,['ethereum'],[],167,2288,595,ETH
2021-10-11 21:19:00 UTC,"Want to earn a super easy passive #crypto income?   Then check out Celsius!   Earn 6.2% #bitcoin, 5.35% #ethereum, 8.88% USDC, (great rates on altcoins too)  Use this link to get $50 by using promo code LARK or referral code 1825690ce9  https://t.co/K6HFhYGCu4",thecryptolark,"['crypto', 'bitcoin', 'ethereum']",[],10,129,44,ETH
2021-10-11 06:45:41 UTC,"Polygon, optimism, arbitrum, and starkware… scaling is already here for #ethereum and it works very well",thecryptolark,['ethereum'],[],73,976,93,ETH
2021-10-11 06:42:29 UTC,Half a million #ethereum has already been burned! Holy cow man! EIP1559 is insane!,thecryptolark,['ethereum'],[],168,2202,201,ETH
2021-10-11 02:09:33 UTC,"Yes, or ETH or USDC",thecryptolark,[],[],1,25,1,ETH
2021-10-10 22:10:00 UTC,"Trade #bitcoin #ethereum #cardano and all the top #crypto #altcoins on Phemex.  Use this link to sign up and get 10% off fees and up to $1,200 trading bonus! $100 standard bonus  $1,100 deposit bonus   https://t.co/TbdGKh6vj0",thecryptolark,"['bitcoin', 'ethereum', 'cardano', 'crypto', 'altcoins']",[],12,61,21,ETH
2021-10-09 21:19:00 UTC,"Want to earn a super easy passive #crypto income?   Then check out Celsius!   Earn 6.2% #bitcoin, 5.35% #ethereum, 8.88% USDC, (great rates on altcoins too)  Use this link to get $50 by using promo code LARK or referral code 1825690ce9  https://t.co/K6HFhYGCu4",thecryptolark,"['crypto', 'bitcoin', 'ethereum']",[],23,192,70,ETH
2021-10-09 07:48:04 UTC,The end of proof of work and the birth of proof of stake will be massive for #Ethereum!,thecryptolark,['ethereum'],[],159,2408,193,ETH
2021-10-08 03:42:10 UTC,BTW here is the ETH story   https://t.co/xwGNYejYv3,thecryptolark,[],[],57,440,41,ETH
2021-10-08 03:15:55 UTC,"JP Morgan says that big money prefers #bitcoin over gold, they also say that they prefer #ethereum over BTC.   So I guess it goes like this  #1 ETH #2 BTC #3 Gold   Do you agree?    https://t.co/JS4HyaAdDD",thecryptolark,"['bitcoin', 'ethereum']",[],468,2778,431,ETH
2021-10-07 21:09:00 UTC,"Trade #bitcoin #ethereum #cardano and all the top #crypto #altcoins on Phemex.  Use this link to sign up and get 10% off fees and up to $1,200 trading bonus! $100 standard bonus  $1,100 deposit bonus   https://t.co/TbdGKgOTUq",thecryptolark,"['bitcoin', 'ethereum', 'cardano', 'crypto', 'altcoins']",[],12,107,38,ETH
2021-10-07 00:36:31 UTC,Just another major global bank using #Ethereum  https://t.co/UkOjLXDGW5,thecryptolark,['ethereum'],[],146,1040,47,ETH
2021-10-06 20:56:47 UTC,Step 1: #bitcoin ETF gets approved Step 2: #ethereum ETF gets approved Step 3: M O O N that spells moon,thecryptolark,"['bitcoin', 'ethereum']",[],229,2407,141,ETH
2021-10-06 05:25:34 UTC,"I have talked about Anchor many many times before, great protocol, sure, take your stables there. Take your BTC and ETH to celsius",thecryptolark,[],[],0,6,2,ETH
2021-10-06 02:06:00 UTC,"Want to earn a super easy passive #crypto income?   Then check out Celsius!   Earn 6.2% on #bitcoin, 5.35% on #ethereum, 8.88% on USDC, and great rates on loads of other coins!   Use this link to start your account and code LARK to get a $50 sign up bonus  https://t.co/K6HFhYYdSE",thecryptolark,"['crypto', 'bitcoin', 'ethereum']",[],35,399,79,ETH
2021-10-05 22:05:05 UTC,#ethereum has settled 6.2 trillion in the last 12 months.... wow!!!  https://t.co/UJtVMForj5,thecryptolark,['ethereum'],[],147,1039,41,ETH
2021-10-05 02:20:38 UTC,"What #crypto are you buying this week?  I bought #bitcoin and $movr, bids in to get some more #ethereum too, but they have not filled.",thecryptolark,"['crypto', 'bitcoin', 'ethereum']",['movr'],115,1235,707,ETH
2021-10-04 02:04:00 UTC,"Trade #bitcoin #ethereum #cardano and all the top #crypto #altcoins on Phemex.  Use this link to sign up and get 10% off fees and up to $1,200 trading bonus! $100 standard bonus  $1,100 deposit bonus  https://t.co/TbdGKgOTUq",thecryptolark,"['bitcoin', 'ethereum', 'cardano', 'crypto', 'altcoins']",[],10,93,18,ETH
