created_at,tweet,username,hashtags,cashtags,retweets_count,likes_count,replies_count
2021-11-30 21:17:29 UTC,"MARKET WRAP: Ether $ETH and other altcoins are outperforming bitcoin $BTC, indicating greater appetite for risk among investors.  reports.  https://t.co/rYIWRUQHR3",coindesk,[],"['eth', 'btc']",23,139,70
2021-11-30 17:12:44 UTC,"The use of ETH as money could act as a complement to fiat, stablecoins and other stores of value – and one that could potentially become a currency of the #metaverse.   explores the idea for #Crypto2022.   https://t.co/lZXoer3mAE",coindesk,"['metaverse', 'crypto2022']",[],26,113,36
2021-11-30 16:31:53 UTC,"One of the biggest and most notable crypto donations this year came from Ethereum figurehead .   He sent 50 trillion , worth a nominal $1.2 billion at the time, to the India Covid Crypto Relief Fund in May.    https://t.co/W5AgiZdJWI",coindesk,[],[],335,1129,89
2021-11-29 16:14:22 UTC,"Money used to be simple. #Bitcoin changed everything.  Then came #ETH, #Tether, $DOGE, CBDCs, social tokens, NFTs and more. Money can be many things, and it just gets weirder.  We're exploring the future of money for #Crypto2022 🧵👇   https://t.co/pPSKtY3s8K  https://t.co/exRGND1SHn",coindesk,"['bitcoin', 'eth', 'tether', 'crypto2022']",['doge'],56,136,257
2021-11-25 18:27:53 UTC,"“Ethereum gave me freedom,” , co-founder of , said. “And I’m always looking for ways to give back and to get some freedom for others as well.”  Opinion by  for The Node newsletter.  https://t.co/okc6x2b68Z",coindesk,[],[],43,149,256
2021-11-24 21:19:09 UTC,MARKET WRAP: Bitcoin $BTC and ether $ETH could see sharp price moves after the U.S. Thanksgiving holiday on Thursday. Here’s a rundown from crypto traders and analysts.   https://t.co/QmTsryvPzg,coindesk,[],"['btc', 'eth']",37,144,63
2021-11-24 18:24:34 UTC,". is ending free withdrawals for certain coins, citing “increasing transaction costs on the Ethereum network.”   reports   https://t.co/MCUzqlH8e5",coindesk,[],[],22,75,44
2021-11-24 16:06:34 UTC,"In a move that highlights gray areas in sanctions law facing the crypto industry,  removed about 50 Iranian students from its Ethereum coding course.   reports   https://t.co/h64Y7Ojxxy",coindesk,[],[],1153,1455,349
2021-11-23 21:16:21 UTC,"MARKET WRAP: Bitcoin $BTC is stabilizing as altcoins such as ether $ETH outperform, suggesting a greater appetite for risk among traders.   https://t.co/1O0JT67Cvb",coindesk,[],"['btc', 'eth']",29,150,136
2021-11-22 22:06:03 UTC,"As it’s now set up, Ethereum primarily benefits the already ETH-rich.  Opinion by   for The Node newsletter.  https://t.co/iKdhCZGPKM",coindesk,[],[],32,116,68
2021-11-22 14:05:00 UTC,"The Ethereum Virtual Machine (EVM) is coming to  with the launch of Emerald, and multiple Ethereum-native protocols could be following soon.    reports  https://t.co/gMlPwaa9er",coindesk,[],[],166,542,59
2021-11-21 13:58:41 UTC,"Many believe that Ethereum, ,  or  will power everything on the web. But there’s a problem: on-chain storage.  Imagine if every “like” or follow on a dapp cost $1.00+ in storage fees.   writes:  https://t.co/yPRwl9mxTA",coindesk,[],[],104,385,171
2021-11-19 23:26:29 UTC,"What drives $ETH?   '  breaks it down to three parts: The global macro-environment, overall capital gains in the crypto markets and progress with Web 3.  Watch the full spotlight, presented by :  https://t.co/Y46T41QwKO  https://t.co/xBu4F5VJkQ",coindesk,[],['eth'],26,112,58
2021-11-19 00:16:55 UTC,"Pair of artworks by Banksy sell for 1,397 ETH and 1,696 ETH, respectively, in first sales for crypto 's auction house. The total sale is worth over $12.3 million.   reports  https://t.co/Hlc78yF2ga",coindesk,[],[],61,213,69
2021-11-18 22:38:15 UTC,"""Some of our employees are using DeFi on Ethereum and Solana, and their testimonies are compelling,"" 's  says.   ""The fees on Ethereum were just too high.""  The browser plans to add  support by 2022.  Presented by :  https://t.co/BGneV8hOry  https://t.co/N0HOG7mmy7",coindesk,[],[],86,413,72
2021-11-18 21:14:58 UTC,"MARKET WRAP: Bitcoin $BTC, ether $ETH and other cryptos tumbled on Thursday as traders appear to be in no hurry to buy. Volume remains low amid regulatory concerns.  https://t.co/nlUU4UYRkE",coindesk,[],"['btc', 'eth']",16,86,52
2021-11-18 20:45:20 UTC,"IN-DEPTH: As the first  parachain auction wraps up, founder  explains how the network's model stands in stark contrast to Ethereum.   reports   https://t.co/32kwadUWpl",coindesk,[],[],199,816,93
2021-11-18 17:01:13 UTC,"LIVE on ""The Hash"":   📃  raised over $40 million to buy a copy of the U.S. Constitution ⌛️  to hold $ETH on the balance sheet 💳  will stop accepting  credit cards issued in the U.K.  Watch on  https://t.co/yHMYaDz7D6:  https://t.co/CPlWDzC6aO",coindesk,[],['eth'],9,48,26
2021-11-17 22:44:59 UTC,"LATEST:  donations have soared to over 6,400 $ETH, or roughly $27 million.  The group will place a competitive bid on Thursday for one of 13 copies of the Constitution of the United States.   reports    https://t.co/9druaDFFpy",coindesk,[],['eth'],44,159,42
2021-11-17 18:40:33 UTC,"""What drives long-term value on Ethereum versus Bitcoin ... is the value that's built on top of the network,"" 's  says.  Plus, he explains why the company is minting historic ETH blocks into NFTs.   Presented by :  https://t.co/U6HJMTozWQ  https://t.co/ArUgguSTyh",coindesk,[],[],15,60,42
2021-11-17 14:00:33 UTC,"LIVE on ""First Mover"":  allows users to mint Ethereum blocks as NFTs,  launches crypto for Afghan women and more.  ,  and  join  https://t.co/yHMYaDyzNy:  https://t.co/9j6wrRAIf8",coindesk,[],[],7,34,22
2021-11-17 12:35:07 UTC,"The successes of Solana, Avalanche and layer 1 protocols have not necessarily come at the expense of Ethereum. In fact, the ecosystems are thriving in parallel, with applications deploying on all chains,  explains.  https://t.co/IbOudotE7k",coindesk,[],[],35,155,61
2021-11-16 16:59:53 UTC,NEW: ’s latest browser update includes a native crypto wallet that supports Ethereum and all EVM-compatible chains.   reports   https://t.co/z9SSe5R0PB,coindesk,[],[],78,376,72
2021-11-15 16:43:27 UTC,"Bloomberg and Galaxy Digital released a Solana index to track the performance of $SOL, only their third standalone index behind $BTC and $ETH.   reports   https://t.co/9yjQpijg0G",coindesk,[],"['sol', 'btc', 'eth']",74,279,58
2021-11-13 21:47:13 UTC,What's the difference between Bitcoin and Ethereum? 🤔  #cryptoliteracymonth with River Crypto  Comment on #TikTok:    https://t.co/tZAdipSV5n,coindesk,"['cryptoliteracymonth', 'tiktok']",[],28,93,53
2021-11-12 18:41:35 UTC,"Ethereum, the second-largest crypto by market cap, is intended to be much more than simply a medium of exchange or a store of value.  Today's #CryptoLiteracyMonth lesson takes a step back to break down the basics.  Take the  quiz:  https://t.co/6NFYo5mpEf  https://t.co/c7qlh4MmQ2",coindesk,['cryptoliteracymonth'],[],131,328,277
2021-11-12 14:00:10 UTC,"LIVE:  to accept crypto payments,  to allow live bidding in $ETH and more.  ,  of  and  of  join ""First Mover"" on  https://t.co/yHMYaDyzNy:  https://t.co/4HC4cp7OAa",coindesk,[],['eth'],27,87,44
2021-11-12 00:03:22 UTC,"What is the relationship between #bitcoin, $ETH and stocks?  Watch Chart of the Day, presented by :  https://t.co/LVq1IEwWSc  https://t.co/WWtyelU5gd",coindesk,['bitcoin'],['eth'],27,89,67
2021-11-11 21:26:59 UTC,"MARKET WRAP: Bitcoin $BTC is stabilizing along with ether $ETH, and some analysts remain bullish despite short-term price swings.  https://t.co/D0g6BgPF8H",coindesk,[],"['btc', 'eth']",22,126,58
2021-11-11 17:00:34 UTC,"LIVE on ""The Hash"":  🇨🇳China's Xi paving way to an unprecedented third term 🖼 to allow live bidding in $ETH 📃 withdraws #bitcoin futures ETF filing 👾 teases getting into crypto and NFTs  Watch on  https://t.co/yHMYaDyzNy:  https://t.co/OFBKjYsdNL",coindesk,['bitcoin'],['eth'],11,34,36
2021-11-10 14:02:09 UTC,"CoreWeave, the specialized cloud service provider and Ethereum miner, has raised $50 million from Magnetar Capital to provide high-performance computing infrastructure.   reports   https://t.co/9t3G4H7Pg9",coindesk,[],[],10,55,20
2021-11-10 12:36:03 UTC,"With the progress being made on #Ethereum's Beacon Chain over the past few weeks, we thought it was time for   to give an update on 's validator, whom we've affectionately nicknamed ""Zelda.""   https://t.co/lCKsWVcN8x",coindesk,['ethereum'],[],23,81,26
2021-11-10 12:35:01 UTC,"With the progress being made on Ethereum's Beacon Chain over the past few weeks, we thought it was time to give an update on CoinDesk's validator, whom we've affectionately nicknamed ""Zelda.""   https://t.co/kLrCNT9qrg  #Ethereum #blockchain #cryptonews #defi",coindesk,"['ethereum', 'blockchain', 'cryptonews', 'defi']",[],9,62,25
2021-11-10 12:07:52 UTC,BTC and ETH hit new all-time highs yet again.   explores the micro and macro factors driving this most recent all-time high.  Listen:  https://t.co/DINQ8sxhGX  https://t.co/ASwurdDT2V,coindesk,[],[],29,174,40
2021-11-09 22:12:22 UTC,Who's the latest surprise holder of BTC and ETH?   covers the driving factors behind new all-time highs &amp; 's latest statements on crypto.  Listen:  https://t.co/DINQ8sxhGX  https://t.co/8kLPrFPWdQ,coindesk,[],[],29,187,33
2021-11-09 17:17:01 UTC,Ethereum Name Service’s $ENS token is soaring after its highly successful genesis airdrop.   reports   https://t.co/UWAqBNs3XV,coindesk,[],['ens'],19,88,23
2021-11-09 17:01:14 UTC,"LIVE on ""The Hash"":  🍎  CEO reveals he owns crypto 👾  hints at Ethereum compatibility 🎽 DEXs have grown the most as a competition among crypto exchanges ⛓ Does everything need to be on the blockchain?  Watch on  https://t.co/yHMYaDyzNy:  https://t.co/3ZU16Il66Z",coindesk,[],[],10,43,17
2021-11-09 15:09:13 UTC,". announced plans to launch a 'Liquidity Hub' for enterprises to access BTC, ETH, LTC, ETC, BCH and XRP. By   https://t.co/1WHXJwFHTQ",coindesk,[],[],265,1165,60
2021-11-09 10:36:38 UTC,"NEW: Investors piled $40 million into , a project bringing Ethereum’s computation engine to the Solana blockchain.   reports   https://t.co/pvIGdmqNcP",coindesk,[],[],99,495,43
2021-11-09 04:30:56 UTC,"Jason Citron posted a screenshot of what appears to be Discord settings that allow users to connect to Ethereum, saying “probably nothing.”    reports   https://t.co/OlaggXEDNV",coindesk,[],[],95,419,58
2021-11-08 15:08:23 UTC,"., the firm behind Ethereum Layer 2 scaling protocol , has raised $50 million in a Series B funding round led by Andreessen Horowitz . By   https://t.co/DxnF5X7UuP",coindesk,[],[],14,90,33
2021-11-07 14:41:07 UTC,"At issue is the valuation of key pillars of the Ethereum ecosystem, including  and .   https://t.co/tulZqdZt0G",coindesk,[],[],28,117,55
2021-11-04 20:29:12 UTC,"MARKET WRAP: Bitcoin $BTC lags altcoins such as ether $ETH and solana $SOL, but not all is lost for the top crypto by market cap.  https://t.co/BrS2fNVyC4",coindesk,[],"['btc', 'eth', 'sol']",23,107,35
2021-11-04 16:00:34 UTC,"LIVE on ""The Hash"":  🧑‍⚖️ Kleiman v. Wright: The #bitcoin trial of the century 🦊  and  users targeted in crypto phishing attack 🎲 Ethereum alternatives and gaming tokens outperform $ETH and $BTC  Watch on  https://t.co/yHMYaDyzNy:  https://t.co/Ak8BKm3UnY",coindesk,['bitcoin'],"['eth', 'btc']",22,75,153
2021-11-04 13:00:44 UTC,"LIVE: #Ethereum hits fresh all-time high and #bitcoin's trial of the century is underway.  's Timothy Massad, 's ,  and  of  join ""First Mover"" on  https://t.co/yHMYaDyzNy:  https://t.co/Q9KSQunnMU",coindesk,"['ethereum', 'bitcoin']",[],11,49,22
2021-11-03 16:39:22 UTC,"#Ethereum hit another all-time high.   of CoinDesk Indexes says institutions are now ""understanding they need to start diversifying away from the risk of #bitcoin alone.""  Watch the full markets analysis on $ETH, presented by :  https://t.co/vabdMaUXnB  https://t.co/hgxyNG64a5",coindesk,"['ethereum', 'bitcoin']",['eth'],18,94,23
2021-11-03 12:46:47 UTC,"Coming up on ""First Mover"":  •  on what's driving the #ETH rally • Congressman  on the Biden administration's stablecoin regulation proposals •  chats about the second annual    Tune in at 9 a.m. ET on  https://t.co/yHMYaDyzNy:  https://t.co/vUXq7V6L9p",coindesk,['eth'],[],12,40,13
2021-11-03 11:35:03 UTC,"A future in which #Ethereum can continue to subsidize validators without diluting those that hold ether is very promising for the network, says  in this week's Valid Points newsletter.  https://t.co/ijHrmzuEbo",coindesk,['ethereum'],[],15,76,21
2021-11-03 11:17:17 UTC,Rising Ethereum fees are forcing investors to look more closely at cheaper alternatives.  reports.   https://t.co/pyMc8Uye40,coindesk,[],[],75,340,83
2021-11-01 18:01:14 UTC,"$XRP, $BNB and $ADA have all at one point been the ""third coin,"" the alternative to BTC and ETH that new investors pick.  ""There are fewer more dangerous positions to occupy than third in cryptocurrency. The only way is down"" –   Opinion.  https://t.co/Q2MKeRtoCv",coindesk,[],"['xrp', 'bnb', 'ada']",32,147,81
2021-11-01 16:02:34 UTC,NEW: Market maker  is ramping up its DeFi activity. It already moves $1 billion daily on Ethereum- and Solana-based DEXs.   reports   https://t.co/MDsSLHZumW,coindesk,[],[],17,52,18
2021-11-01 13:00:24 UTC,"LIVE:  attracts thousands of attendees this year, Ethereum jumped to a record high amid crypto's decentralized boom and more.  ,  and  join ""First Mover"" on  https://t.co/yHMYaDyzNy:  https://t.co/Q9lzgzX1Ft",coindesk,[],[],14,61,63
2021-11-01 10:04:14 UTC,". is teaming up with  to offer BTC, ETH and DOGE as prizes to customers.  By   https://t.co/5Xl3HTQCsE",coindesk,[],[],510,1564,189
2021-10-29 20:22:25 UTC,"MARKET WRAP: Ether $ETH reached a new all-time high, extending its outperformance vs. bitcoin $BTC as traders rotate into altcoins.  https://t.co/gnDwPhuPJr",coindesk,[],"['eth', 'btc']",39,151,60
2021-10-29 14:55:23 UTC,"Ether’s all-time-high gives Ethereum miner  shares a boost,  reports.   https://t.co/ElpKlSpJsb",coindesk,[],[],36,173,39
2021-10-28 20:30:33 UTC,Bitcoin $BTC traders get whiplash as price bounces around $60K and $ETH outperforms. All eyes on options expiry tomorrow.  https://t.co/LACvYh80bY,coindesk,[],"['btc', 'eth']",19,112,43
2021-10-27 16:00:19 UTC,"ArenaX Labs has closed a $5 million seed round led by  to accelerate the development of AI Arena, an Ethereum-native player vs. player fighting game where the characters are powered by artificial intelligence.  By  ​​ https://t.co/3HE2zGa1UY",coindesk,[],[],6,31,16
2021-10-27 15:22:30 UTC,".'s Ethereum-based total value locked (TVL) of $1 billion appears to have been almost entirely drained, and the attacker made off with $130 million.   reports.  https://t.co/SmSfcSiA1A",coindesk,[],[],14,86,47
2021-10-27 14:59:43 UTC,DEVELOPING:  appears to have been drained of all Ethereum-based assets in a massive flash loan exploit.   reports.  https://t.co/Cwc2D4g2fH,coindesk,[],[],23,92,47
2021-10-27 11:32:03 UTC,"Are DeFi, deflation and #Ethereum's coming transition to proof-of-stake working to make ETH “Ultra Sound Money”?  lays it out.  https://t.co/19usTeJrUv",coindesk,['ethereum'],[],14,59,28
2021-10-26 20:37:19 UTC,"""I don't think a lot of the people who have been reading  for 50 years are necessarily equipped to engage with that technology,""  says, discussing the newspaper's NFT cover art which sold for 99 $ETH.  Presented by :  https://t.co/RlanZ1Tdnn  https://t.co/JiaE4ReSbx",coindesk,[],['eth'],7,37,10
2021-10-22 20:31:42 UTC,MARKET WRAP: Bitcoin $BTC declined to around $60K as ETF enthusiasm fades. Ether $ETH is outperforming.  https://t.co/kqNjjbO3I3,coindesk,[],"['btc', 'eth']",34,154,128
2021-10-20 15:41:02 UTC,"While all eyes are on #bitcoin at the moment,  quietly sent away trillions of unwanted DOGE knockoffs sent to his Ethereum wallet.   reports   https://t.co/8rgACYdl3L",coindesk,['bitcoin'],[],11,94,31
2021-10-20 11:34:05 UTC,"Also:  sums up this week's fun and games in #Ethereum, #DeFi and the #metaverse.   https://t.co/OJdEG2BEuq",coindesk,"['ethereum', 'defi', 'metaverse']",[],9,61,55
2021-10-14 20:32:41 UTC,MARKET WRAP: Ether $ETH is outperforming bitcoin $BTC again. Could altcoins catch up as the crypto rally continues?   reports.   https://t.co/3uggOVSAUi,coindesk,[],"['eth', 'btc']",885,1212,208
2021-10-14 13:03:55 UTC,"Positioning itself as a help to Ethereum rather than a competitor,  has raised $12 million to expand the layer-two's nascent #DeFi ecosystem.   reports   https://t.co/WTfZK3M7B7",coindesk,['defi'],[],31,145,34
2021-10-14 04:12:38 UTC,"China’s Blockchain Services Network, which is divided onto a Chines version and an international version, is integrating Cypherium blockchain, joining the likes of Ethereum, Hyperledger and others.     reports.   https://t.co/l9TAg1I91X",coindesk,[],[],56,133,39
2021-10-13 17:40:22 UTC,"In the U.S., $DOGE is as adopted as $ETH. Japan and South Africa are big on #bitcoin. Australia and Russia are topping $ADA adoption.  's  discusses the findings of its cryptocurrency adoption index on ""First Mover"":  https://t.co/rlTSNGpZs2  https://t.co/Foa4HGkBjO",coindesk,['bitcoin'],"['doge', 'eth', 'ada']",56,178,40
2021-10-13 17:00:45 UTC,"Retail users are selling, institutions are buying #bitcoin and #ethereum,  CEO Rob Catalanello tells #CDTV.  The firm found the latest rally was not driven by retail traders. He also breaks down the findings by region.  Presented by :  https://t.co/NdEaRTHCdG  https://t.co/raj26LN8AY",coindesk,"['bitcoin', 'ethereum', 'cdtv']",[],48,55,26
2021-10-13 11:33:00 UTC,Here are some things that will (and won’t) change after the Merge. Also:  checks in on top #Ethereum news stories from the past week.  https://t.co/2tiiU5Y7Nm,coindesk,['ethereum'],[],10,33,14
2021-10-11 16:01:39 UTC,"LIVE on ""The Hash"":  ⚖️ 'a take on El Salvador's #bitcoin law 💰  is raising a $1.5 billion fund to invest in crypto projects 🔷 Sign-in with Ethereum is coming ♦️ NFT rentals are here  Watch on  https://t.co/yHMYaDyzNy:  https://t.co/he4HojtEhI",coindesk,['bitcoin'],[],12,34,19
2021-10-11 08:36:18 UTC,"., the blockchain startup that develops and invests in Ethereum-based projects, is in funding talks that might see it valued at $3 billion.  By   https://t.co/QJHvFjX4Hm",coindesk,[],[],47,163,69
2021-10-08 20:52:15 UTC,MARKET WRAP: Bitcoin $BTC and Ethereum $ETH both post strong double-digit gains for the week.  reports.  https://t.co/e80k1oE9zc,coindesk,[],"['btc', 'eth']",28,119,28
2021-10-08 19:04:00 UTC,Ethereum co-founder  had some harsh words for Salvadoran President  in a Reddit forum on Friday.  By   https://t.co/480tPmI6hC,coindesk,[],[],101,506,226
2021-10-08 17:45:01 UTC,Ethereum clients are pieces of software written in different programming languages and enable users to interact with the blockchain network.  https://t.co/zlFqjgfl3y,coindesk,[],[],36,88,18
2021-10-08 17:22:29 UTC,"NEW:  is leading a $1.5 million bet on , a year-old DAO that lets you rent out your Ethereum NFTs.   reports   https://t.co/0dFZmgf3DL",coindesk,[],[],16,96,13
2021-10-07 19:08:56 UTC,ETH Zurich’s Blockchain Initiative serves as a meeting hub for some of the best minds in blockchain. Its alumni have gone on to assume some important positions within the blockchain industry.   It is 10th on our ranking of 230 schools worldwide.      https://t.co/OjdgCamUjo  https://t.co/mlBL3Ao7Y6,coindesk,[],[],11,44,12
2021-10-06 20:15:44 UTC,"Despite their rivalry,  flagged a “critical severity” bug in Ethereum 2.0 staking services  and  yesterday – part of a unified effort to make Ethereum's jump to proof-of-stake a reality.    reports   https://t.co/iyNHbDLYYI",coindesk,[],[],20,111,21
2021-10-06 11:33:02 UTC,"It's probably too early to properly assess how changes to the #Ethereum fee market and the addition of a burn mechanism have affected all aspects of the user experience, says .   https://t.co/njlZjgBhwL",coindesk,['ethereum'],[],25,73,23
2021-10-05 16:27:07 UTC,"On Oct. 27, at epoch 74240, the Altair Beacon Chain upgrade is scheduled to activate on the #Ethereum mainnet.  and  report.   https://t.co/ZpJgNbREOR",coindesk,['ethereum'],[],17,79,31
2021-10-05 05:31:03 UTC,NEW:  is taking part in tokenizing shares of a Swiss sports resort using the Ethereum blockchain.   reports   https://t.co/rYaUP3Xzl5,coindesk,[],[],149,599,43
2021-10-04 13:45:02 UTC,"Coming up: The one-year anniversary of ""Money Reimagined.""   . and  bring back  and  to discuss the explosive growth of #bitcoin and Ethereum, stablecoins, DeFi, NFTs and more.  Tune in at 10 a.m. ET on  https://t.co/yHMYaDyzNy:  https://t.co/aVFZfPmJeR",coindesk,['bitcoin'],[],13,30,17
2021-10-04 07:39:13 UTC,Polygon’s number of unique daily active addresses has surpassed Ethereum's for the first time on record.   reports.   https://t.co/mDsMYYLTHd,coindesk,[],[],261,1169,85
2021-10-02 14:07:09 UTC,"In retrospect, if North Korea had grand plans for cryptocurrency, why would it show it to random foreigners like us?   takes us into the trip where Ethereum developer Virgil Griffith was arrested:  https://t.co/Mk2kpvETHf",coindesk,[],[],22,72,14
2021-10-02 12:51:46 UTC,"A growing number of Ethereum enthusiasts believe that DAOs are due for a mainstream breakthrough.  Unfortunately, placing a bet on that trend playing out isn’t as cut and dry as buying some tokens.  https://t.co/lepYBQefJf",coindesk,[],[],34,147,34
2021-10-01 18:02:20 UTC,Ledger = blockchains like Ethereum  Currency = eg bitcoin  Debt = DeFi  Property = Non-fungible tokens (NFTs)  We have the fundamental building blocks we need for a new financial system.   Opinion for the Money Reimagined newsletter by    https://t.co/zmxuAklAxu,coindesk,[],[],36,133,39
2021-09-30 23:25:15 UTC,History in the making:  is working with  to facilitate a $20 million DAI loan backed by bond tokens issued on Ethereum by a bank subsidiary.    reports   https://t.co/SXRlI43BXb,coindesk,[],[],50,147,39
2021-09-30 18:48:37 UTC,"Avalanche, Solana and other “smart contract” blockchain alternatives to Ethereum were among the few crypto winners in September.   reports.   https://t.co/FWQ1CDslPl",coindesk,[],[],20,67,24
2021-09-29 11:34:05 UTC,“You’re only as strong as your weakest link.” This adage is especially true when it comes to decentralization and even more important when you are potentially building a new base layer for the world economy. #Ethereum  reports.   https://t.co/a9JAOHIMql,coindesk,['ethereum'],[],26,100,23
2021-09-28 19:13:32 UTC,"Remember that ""erroneously high"" gas fee that cost  $23.7 million on a transaction that should've cost $5?  A friendly Ethereum miner has returned the funds.   reports   https://t.co/tA7eANZwHc",coindesk,[],[],56,345,58
2021-09-28 16:00:33 UTC,"LIVE on ""The Hash"":  💰  will allow users to deposit paycheckss 🐝 Chinese Ethereum mining pool  closes 🪙  to launch crypto tokens 💽 U.S. Senators proposes tracking foreign crypto mining  Watch on  https://t.co/yHMYaDyzNy:  https://t.co/HBhaCrKVwZ",coindesk,[],[],7,51,21
2021-09-28 15:09:03 UTC,"BeePool, the world’s fourth-largest Ethereum mining pool in terms of hash rate, said it will suspend all its services to miners starting on Oct. 15.  By    https://t.co/Cg3KDliHl5",coindesk,[],[],27,111,26
2021-09-28 13:00:26 UTC,"LIVE: An author familiar with Ethereum developer Virgil Griffith sheds light on the conspiracy case, the U.S. House to vote on the infrastructure bill and more.  , Ben McMillan and  join ""First Mover"" on  https://t.co/yHMYaDyzNy:  https://t.co/popCvbfHBm",coindesk,[],[],15,34,9
2021-09-27 15:59:02 UTC,"LIVE on ""The Hash"":  🇰🇵 Ethereum developer Virgil Griffith pleads guilty in North Korea 🆇   raises over $12.5 million 🎇   to halt all services 🇸🇻  A third of Salvadorans are using   Watch on  https://t.co/yHMYaDyzNy:  https://t.co/5JyCoeeRv1",coindesk,[],[],11,50,18
2021-09-27 15:21:42 UTC,"China-based SparkPool, the world’s second-largest Ethereum mining pool, said it plans to suspend services for all its users by September 30.    https://t.co/VNRGMb2JJM",coindesk,[],[],39,144,27
2021-09-27 14:38:13 UTC,BREAKING: Ethereum developer Virgil Griffith has pleaded guilty to one charge of conspiracy to violate federal sanctions laws stemming from a trip to North Korea in 2019.   reports   https://t.co/xCFScmROUA,coindesk,[],[],163,440,65
2021-09-27 13:02:07 UTC,"Ethereum scaling solution  X raised over $12.5 million in a token sale on , selling out its IMX tokens in less than an hour.  By   https://t.co/YbznfuIjpx",coindesk,[],[],57,291,36
2021-09-24 05:58:31 UTC,"The Future of Life Institute, a charity and outreach organization, is launching two fellowship programs named after Ethereum co-founder .     reports.   https://t.co/K3pgC4ivx7",coindesk,[],[],50,162,68
2021-09-23 18:28:28 UTC,"The spread between futures prices and spot prices for $BTC vs. $ETH is telling, according to JPMorgan analysts.  By    https://t.co/IGKnIdrDd4",coindesk,[],"['btc', 'eth']",25,87,16
2021-09-23 10:14:17 UTC,says its new bitcoin and ethereum trusts will cut downside risk through active management.   reports.  https://t.co/ZQPdzbDeb3,coindesk,[],[],3,1,0
2021-09-22 21:23:32 UTC,. launches as #Ethereum's newest layer 2.    spoke with Boba Network CEO    https://t.co/Hi7mA3MgEw,coindesk,['ethereum'],[],96,259,73
2021-09-18 07:40:16 UTC,"""Don't hold me to it, but ... I could see it doubling, if not more,"" Charles Allen, CEO of , says of #Ethereum after the ETH 2.0 upgrade.  Watch the full markets segment on BTCS' bullishness for Ethereum, sponsored by :  https://t.co/zJWmxpdF29  https://t.co/9FEwG2aksK",coindesk,['ethereum'],[],27,91,19
