created_at,tweet,username,hashtags,cashtags,retweets_count,likes_count,replies_count
2021-09-04 08:10:00 UTC,I have just updated my Elliott wave count for $LTC / $USD following the pump we saw yesterday .. Please like and retweet and i will share later this morning legends ♥️,cryptotony__,[],"['ltc', 'usd']",62,395,17
2021-09-03 20:09:30 UTC,"Will we see #Litecoin / $LTC at $1,000 + this year legends 👀",cryptotony__,['litecoin'],['ltc'],4,33,12
2021-09-03 18:25:32 UTC,Green dildo time on #Litecoin /   https://t.co/nek3L02smP,cryptotony__,['litecoin'],[],5,72,10
2021-09-03 13:12:19 UTC,"If #Bitcoin can remain steady at the weekend, then we will see a solid #Altcoin run across the board   Coins I am watching or in include $HTR $XRP $XLM $AVAX $ZIL $LTC and a few others ⚡️",cryptotony__,"['bitcoin', 'altcoin']","['htr', 'xrp', 'xlm', 'avax', 'zil', 'ltc']",28,299,30
2021-09-02 05:34:33 UTC,Good morning legends   So #Bitcojn held up well and remains looking strong .. best case it seems we may not get the C wave down I am looking for. But this means we should see our #Altcoins continue to run ⚡️  A few to watch include $ZIL $DOGE $YFI $LTC ⚡️,cryptotony__,"['bitcojn', 'altcoins']","['zil', 'doge', 'yfi', 'ltc']",14,157,15
