created_at,tweet,username,hashtags,cashtags,retweets_count,likes_count,replies_count
2021-11-30 20:50:41 UTC,I’ve laid out my plans on many #Altcoins tonight in my private group legends   Updates just now on $BTC $ETH $LTC $ETHBTC $HOT $BNB $HTR $SUSHI   Check it out  https://t.co/p3HicSFNfJ  https://t.co/7RoYeW1KOb,cryptotony__,['altcoins'],"['btc', 'eth', 'ltc', 'ethbtc', 'hot', 'bnb', 'htr', 'sushi']",4,44,11
2021-11-29 22:30:50 UTC,Same to you bro 😎❤️,cryptotony__,[],[],0,1,0
2021-11-29 21:22:13 UTC,Anytime bro,cryptotony__,[],[],0,3,0
2021-11-29 20:59:11 UTC,Aw your welcome bro and thanks mate it is crazy ♥️,cryptotony__,[],[],1,6,0
2021-11-29 20:23:11 UTC,Your welcome bro,cryptotony__,[],[],0,8,0
2021-11-29 20:20:30 UTC,Let’s get them bro 😎,cryptotony__,[],[],0,5,1
2021-11-29 20:20:06 UTC,Always a pleasure to talk and have banter daily .. Your one of the breast .. I mean best 👑❤️,cryptotony__,[],[],0,3,2
2021-11-29 18:14:24 UTC,$LTC / $USD - Update   Dare i say it is possible we have bottomed out on #Litecoin here ... Eyes are pealed legends  https://t.co/y2kQLAxt4A,cryptotony__,['litecoin'],"['ltc', 'usd']",26,212,38
2021-11-29 17:56:52 UTC,You lady’s 😏,cryptotony__,[],[],0,4,1
2021-11-29 17:27:40 UTC,Forking hell,cryptotony__,[],[],0,3,1
2021-11-29 17:19:52 UTC,Now hold a spoon please,cryptotony__,[],[],0,25,7
2021-11-29 10:09:00 UTC,I’ve laid out my plans on many #Altcoins this morning in my private group legends   Updates on $BTC $ETH $LTC $SOL $LUNA $ZIL $HTR $LINK $VET $SUSHI   Check it out  https://t.co/nIqyxGD7lv  https://t.co/elaVhR8vkg,cryptotony__,['altcoins'],"['btc', 'eth', 'ltc', 'sol', 'luna', 'zil', 'htr', 'link', 'vet', 'sushi']",7,57,10
2021-11-24 21:57:12 UTC,Just sent out my weekly newsletter and the discord group .. Updates on   - $BTC $ETH $LTC ✅ - $HOT $MANA $CRV ✅  Constant updates with targets and invalidation points ‼️    https://t.co/nIqyxGD7lv  https://t.co/VpCqtVhcts,cryptotony__,[],"['btc', 'eth', 'ltc', 'hot', 'mana', 'crv']",2,22,8
2021-11-21 11:43:22 UTC,Check out my private discord group legends .. I’ve updated $BTC $ETH $LTC daily and have shown my plans going into the new week 🍭  - #Altcoin requests from the legend  ✅ - Daily updates ✅ - Educational content ✅   https://t.co/nIqyxGD7lv  https://t.co/YCOy0jxCj9,cryptotony__,['altcoin'],"['btc', 'eth', 'ltc']",6,33,9
2021-11-20 20:07:00 UTC,"Hoping to wake up tomorrow to :  $100,000 #Bitcoin  $10,000 #Ethereum $1,000 #Litecoin  $589 #Ripple  $100 #Hathor $10 #OKLG $1 #KIBA $0 #Bitconnect   Let's go 🥳",cryptotony__,"['bitcoin', 'ethereum', 'litecoin', 'ripple', 'hathor', 'oklg', 'kiba', 'bitconnect']",[],51,530,134
2021-11-18 15:31:00 UTC,Never go all in on a single trade 💯  Spread your capital across different assets and categories to help mitigate losses   I spread mine between   - Established #Altcoins $ETH $LTC etc ✅ - #Memecoins such as $FLOKI $KIBA $DOGE ✅ - Presales ✅ - #Metaverse ✅,cryptotony__,"['altcoins', 'memecoins', 'metaverse']","['eth', 'ltc', 'floki', 'kiba', 'doge']",11,88,19
2021-11-17 21:39:06 UTC,I have to wait that long 🥺  https://t.co/xF10J7lVAO,cryptotony__,[],[],2,66,7
2021-11-17 18:25:17 UTC,$LTC / $USD - Update   This is what you want to look for to help confirm the local bottom .. The supply zone at 236 will need to be flipped into support for continuation legends .. Let us see if the bulls have the strength to do so  https://t.co/NuqfRkmNGQ,cryptotony__,[],"['ltc', 'usd']",20,172,14
2021-11-15 18:36:25 UTC,Don’t you dare sell 😘,cryptotony__,[],[],0,10,1
2021-11-14 20:14:50 UTC,Shared a few invalidation levels today in my private discord group. It’s important to know when a bias is invalid and when to consider a change in behaviour 😎   Updates on $BTC $LTC $ETH $HTR $BNB  $ZIL $XRP $VET .. Thanks for all the support legends  https://t.co/nIqyxGD7lv  https://t.co/GPOhzyVLyY,cryptotony__,[],"['btc', 'ltc', 'eth', 'htr', 'bnb', 'zil', 'xrp', 'vet']",4,60,12
2021-11-14 20:09:21 UTC,It’s a start ✅,cryptotony__,[],[],0,2,0
2021-11-14 20:09:07 UTC,Always haha,cryptotony__,[],[],0,1,0
2021-11-14 20:08:33 UTC,It’s big sir .. oh and yes that’s what she said 😎,cryptotony__,[],[],0,3,1
2021-11-14 20:08:20 UTC,That’s up to you mate. I will support mass adoption personally 😎,cryptotony__,[],[],0,4,1
2021-11-14 20:05:44 UTC,Big news come out from the legends at  .. Wherever  is then so is $LTC .. LTC converts into FIAT at the time of purchase ‼️  Mass adoption = Send our bags up ✅  https://t.co/3IhIAnZzvw,cryptotony__,[],['ltc'],70,363,26
2021-11-14 17:56:09 UTC,It is a weird feeling when $LTC actually looks more bullish than $BTC and $ETH right now ..   I do not like this feeling lol,cryptotony__,[],"['ltc', 'btc', 'eth']",56,669,88
2021-11-13 19:47:58 UTC,New high incoming in $AVAX / $USD .. Fully prepared for this in the private discord group .. Check it out legends   - Daily updates on $BTC $ETH $LTC aswell as plans on #Altcoin trades I am taking ✅   https://t.co/nIqyxGD7lv  https://t.co/UeX8InBKm2,cryptotony__,['altcoin'],"['avax', 'usd', 'btc', 'eth', 'ltc']",9,59,8
2021-11-11 20:46:01 UTC,Legends,cryptotony__,[],[],1,13,3
2021-11-11 06:42:58 UTC,Good morning legends   Green on the menu ✅ A day of recovery and strong bounces will be delightful   $ZIL $LTC $XRP $CRV $THETA $DOT $LINK,cryptotony__,[],"['zil', 'ltc', 'xrp', 'crv', 'theta', 'dot', 'link']",24,273,24
2021-11-10 09:34:00 UTC,"$LTC is like ... Dip what dip   I say full send to $1,000 ++ 😎",cryptotony__,[],['ltc'],63,653,29
2021-11-09 18:00:54 UTC,Who’s making money on #Litecoin 💯  https://t.co/PQMIegmFXc,cryptotony__,['litecoin'],[],22,295,31
2021-11-09 11:37:00 UTC,$LTC / $USD - Update   I am ready for a dirty pump on #Litecoin .. Anyone else  https://t.co/pDTiir5odp,cryptotony__,['litecoin'],"['ltc', 'usd']",31,295,25
2021-11-09 10:49:58 UTC,Detailed explanation of my $LTC / $USD long I placed end of October .. the Ichimoku was a big reason for my long and consolidation 😎 Currently 28% up on this trade alone 👑  Check out my private discord group legends  https://t.co/nIqyxGD7lv  https://t.co/pMEEUdbLWt,cryptotony__,[],"['ltc', 'usd']",5,59,4
2021-11-09 10:09:00 UTC,So many good looking #Altcoins i have suggested to the private group and on CT over the past few months and weeks including :  $ZIL $HTR $EOS  $CRV $LTC $XRP $THETA $DOT  $FLOKI  What Alts are you guys positioned in for the next run ‼️,cryptotony__,['altcoins'],"['zil', 'htr', 'eos', 'crv', 'ltc', 'xrp', 'theta', 'dot', 'floki']",20,273,105
2021-11-08 18:10:47 UTC,"Goooo #Litecoin .. Like I said earlier this one can be a slow mover most of the time, but when it moves .. IT MOVESS 👑  https://t.co/Z0ak2Cw7EY",cryptotony__,['litecoin'],[],20,149,14
2021-11-08 10:05:00 UTC,"Some coins move quick and others move slowly .. So you need to develop patience with those coins you chose to invest in that move slowly   Two of them are $LTC and $XRP .. They move slow for most of the time, but pump huge when they get going   I have a bag 😎",cryptotony__,[],"['ltc', 'xrp']",41,448,55
2021-11-07 18:19:14 UTC,Tonight’s newsletter has been posted with the following :   - Updates on $BTC $ETH $LTC $ZIL $BAT $THETA $MANA $CRV ✅ - Educational content on how to play Liquidation events ✅ - Educational content on Expanded flats ✅  Check out the discounted prices  https://t.co/nIqyxGD7lv  https://t.co/8pIgGF60D8,cryptotony__,[],"['btc', 'eth', 'ltc', 'zil', 'bat', 'theta', 'mana', 'crv']",2,20,5
2021-11-06 09:43:43 UTC,"It’s over used yes .. Litecoin isn’t dead, it just requires patience which 90% of people don’t have",cryptotony__,[],[],0,1,1
2021-11-05 10:01:00 UTC,$LTC / $USD - Update   We remain in the ascending triangle formation gearing up to flip the EQ into support .. This would be the first great step for the bulls legends  https://t.co/QJ8NUfIguc,cryptotony__,[],"['ltc', 'usd']",23,158,22
2021-11-05 07:51:02 UTC,Another 76% monthly swing trade locked in this morning on $OMG / $USD .. The swing trades for me are the easiest to manage   Just updated $BTC $ETH $LTC $TRIAS $BNB $AKRO in the group ! Check it out for the discounted rate  https://t.co/nIqyxGD7lv  Let’s go legends ❤️  https://t.co/ByO3uyOhfL,cryptotony__,[],"['omg', 'usd', 'btc', 'eth', 'ltc', 'trias', 'bnb', 'akro']",3,31,9
2021-11-04 12:32:00 UTC,$LTC / $USD - Update   We could also see something like this on #Litecoin which would tie in with the C wave drop i am expecting on #Bitcoin over the next week or so  https://t.co/eOyHXZAjCP,cryptotony__,"['litecoin', 'bitcoin']","['ltc', 'usd']",15,122,12
2021-11-04 07:51:07 UTC,Every morning and evening I will update $BTC $ETH and $LTC a long with any Altcoins I am in or looking to get in on ‼️  Enjoy the 30% discount applied for a limited time  https://t.co/nIqyxGD7lv  https://t.co/eHC44inolk,cryptotony__,[],"['btc', 'eth', 'ltc']",7,87,8
2021-11-04 06:50:52 UTC,"Good morning legends   So no change in my #Bitcoin plan shared yesterday .. The ranging has allowed a few #Altcoins to see new ATHs such as $DOT and $AVAX .. Both of which I am long on formal previous updates ‼️   $XRP and $LTC gaining momentum too, which is hopeful 😎",cryptotony__,"['bitcoin', 'altcoins']","['dot', 'avax', 'xrp', 'ltc']",9,159,21
2021-11-03 06:47:33 UTC,"Good morning legends   So we are seeing some nice advances on $XRP $MATIC $LTC $SOL to name a few .. But damn those #Ethereum gas fees are insane ‼️   #Bitcoin seems to be stabilising for now, which is why we are seeing #Altcoins push .. can we continue today 👀",cryptotony__,"['ethereum', 'bitcoin', 'altcoins']","['xrp', 'matic', 'ltc', 'sol']",8,189,21
2021-11-02 14:21:32 UTC,My 30% discount still applies to my private discord group with daily updates on all your favourite #Cryptocurrencies   Updated so far today we have $BTC $ETH $LTC $ATOM $VRA $ZIL $DOT $AVAX $THETA $AXS  Come check it out legends  https://t.co/nIqyxGD7lv  #Ethereum scalp yesterday  https://t.co/4uCas5rjVC,cryptotony__,"['cryptocurrencies', 'ethereum']","['btc', 'eth', 'ltc', 'atom', 'vra', 'zil', 'dot', 'avax', 'theta', 'axs']",5,31,6
2021-11-01 22:22:59 UTC,$LTC / $USD /  - Update   Ascending triangle still in force .. Wen Moon 💯  https://t.co/sOUFnx8OjJ,cryptotony__,[],"['ltc', 'usd']",34,204,16
2021-11-01 08:19:29 UTC,Just updated my private group with $BTC $ETH $LTC $SAND $CHZ $HTR $FET $HBAR .. And many more to come tonight   Check out the private group while my biggest discount is ongoing 👑   https://t.co/nIqyxGD7lv  https://t.co/wQpj0LUnzc,cryptotony__,[],"['btc', 'eth', 'ltc', 'sand', 'chz', 'htr', 'fet', 'hbar']",5,73,9
2021-10-31 21:45:42 UTC,The discount has been applied to my private discount group for a limited time 🎉   - Daily updates on $BTC $ETH $LTC ✅ - #Altcoin updates I am taking or watching ✅  - #Altcoin requests ✅ - Educational material ✅  Check it out legends  https://t.co/nIqyxGD7lv  Let’s dance 🎃  https://t.co/vp5onDkTjE,cryptotony__,"['altcoin', 'altcoin']","['btc', 'eth', 'ltc']",6,57,23
2021-10-29 09:11:00 UTC,It is only a matter of time before we see numerous taking out their previous ATHs ..   $MATIC  $DOGE  $LTC $ZIL .. To name a couple ✅,cryptotony__,[],"['matic', 'doge', 'ltc', 'zil']",64,529,73
2021-10-27 20:11:18 UTC,That looks like shit sir,cryptotony__,[],[],0,4,2
2021-10-27 20:09:43 UTC,Some people are so inventive with their tweets 🤣🤣  https://t.co/ev8JLzrXsz,cryptotony__,[],[],0,1,1
2021-10-27 20:09:17 UTC,Why are you copying my status ?,cryptotony__,[],[],0,8,2
2021-10-27 20:08:16 UTC,Right back at you bro 👑  https://t.co/nOHbfyURjB,cryptotony__,[],[],0,2,0
2021-10-27 20:06:24 UTC,It doesn’t have to be Friday to shout out the legends who complete me 😎                             https://t.co/n1zLfS5ge6,cryptotony__,[],[],7,54,17
2021-10-27 10:49:00 UTC,$LTC / $USD - Update   Keep it simple legends .. Flipping that EQ is all we need to do for a push at the highs again 😎  https://t.co/qcAIAM72eU,cryptotony__,[],"['ltc', 'usd']",18,95,12
2021-10-26 20:27:30 UTC,$LTC / $USD - Update   Just need to flip the resistance zone at $210.00 for continuation legends .. #Litecoin always tends to be the asset that gets everyone bored before putting in crazy pumps   I have a bag 😎  https://t.co/UVVNIfsYGd,cryptotony__,['litecoin'],"['ltc', 'usd']",29,210,26
2021-10-24 15:32:03 UTC,30% bump in my $HTR / $USD call last week in my weekly Sunday newsletter .. Plus a few others such as $SOL that came in nicely   Today’s newsletter includes updates on   $HTR $SOL $SHIB $UNI $XLM $THETA $BTC $ETH $LTC ✅  Check it out legends    https://t.co/nIqyxGD7lv  https://t.co/8sBBBn7Q8F,cryptotony__,[],"['htr', 'usd', 'sol', 'htr', 'sol', 'shib', 'uni', 'xlm', 'theta', 'btc', 'eth', 'ltc']",7,45,2
2021-10-24 09:22:18 UTC,$LTC / $USD - Update   Just need to flip the EQ (Equilibrium) of this range for continuation .. I am bullish on #Litecoin while we hold the range low at $103  https://t.co/BEhEsZaOd2,cryptotony__,['litecoin'],"['ltc', 'usd']",25,165,12
2021-10-23 09:07:27 UTC,"$LTC / $USD - Update   When it comes to being a successful trader you do need to consider the other bias, once your invalidation comes into play  This is what i shared with my private group yesterday  https://t.co/nIqyxGD7lv I share my main bias and what triggers the other bias  https://t.co/vr65mLdhRA",cryptotony__,[],"['ltc', 'usd']",10,68,15
2021-10-18 06:04:12 UTC,"Good morning legends   So we had some absolute killer weekly closes, which just further enhances my thoughts on new ATH across the board.   Few nice scalps played last night on $LTC and $BTC played out perfect   Start to a good week so far ‼️",cryptotony__,[],"['ltc', 'btc']",9,97,11
2021-10-17 18:20:22 UTC,Sunday’s newsletter has just gone out to all subscribers. In this update I’ve updated   - $BTC $LTC $ETH $HTR $XLM $UNI $SOL and $THETA ✅ - Education on Ranges and impulse wave extensions ✅ - Tier 3 for my discord + Newsletter ✅   https://t.co/nIqyxGD7lv  https://t.co/FbbyfFQlp0,cryptotony__,[],"['btc', 'ltc', 'eth', 'htr', 'xlm', 'uni', 'sol', 'theta']",3,15,6
2021-10-17 12:54:41 UTC,I am focusing on #Altcoins with missing 5th waves .. these are the ones to pay attention to. Of course we have invalidations in place incase of a major reversal  Check out my private discord Tier 3  https://t.co/nIqyxGD7lv where il share all my #Alt plays and $BTC $ETH $LTC daily  https://t.co/BsNxBt04RI,cryptotony__,"['altcoins', 'alt']","['btc', 'eth', 'ltc']",10,85,10
2021-10-16 19:58:50 UTC,While your all distracted by the Fight .. Someone needs to keep an eye on the charts right ‼️  #Bitcoin #Ethereum and #Litecoin charts coming up legends 😎,cryptotony__,"['bitcoin', 'ethereum', 'litecoin']",[],6,162,10
2021-10-16 18:55:46 UTC,Oh wow 🤣,cryptotony__,[],[],0,6,0
2021-10-15 10:23:00 UTC,"$LTC / $USD - Update   Could we finally be looking to flip that supply zone into support. We all know #Litecoin  is a stubborn mover, but no one wants to be left behind when it takes off right 💯  https://t.co/fBYhNHBiJo",cryptotony__,['litecoin'],"['ltc', 'usd']",20,207,12
2021-10-14 09:16:00 UTC,$LTC / $USD - Update   All i want to see is #Litecoin flipping the current supply zone we are against into support .. We are currently attacking it once again after consolidating below for a couple of days ♥️  https://t.co/dyiR1D4eQA,cryptotony__,['litecoin'],"['ltc', 'usd']",28,159,11
2021-10-14 07:10:00 UTC,Who is interested in an update on $LTC / $USD .. I will be sharing my latest update later this morning legends 💯,cryptotony__,[],"['ltc', 'usd']",24,420,38
2021-10-14 06:53:59 UTC,Daily updates morning and evening on my private discord :   - $BTC $ETH and $LTC ✅ - #Altcoins I am in and see potential in ✅ - Live streams via the legend  ✅  Check it out legends and thanks for all the support as always  https://t.co/nIqyxGD7lv  https://t.co/atSsOJEQZx,cryptotony__,['altcoins'],"['btc', 'eth', 'ltc']",4,40,4
2021-10-07 10:24:00 UTC,$LTC / $USD - Update   This is as simple as i can make it for you legends on Litecoin. All we need to do to maintain the bullish bias is hold the swing low at $103.30 ..   Simple as that 💯  https://t.co/QGtdI9jlAb,cryptotony__,[],"['ltc', 'usd']",19,119,8
2021-10-07 08:36:00 UTC,I have updated my $LTC / $USD chart and have kept it as simple as i can for new traders   Please like and retweet legends and i will share later this morning ♥️,cryptotony__,[],"['ltc', 'usd']",54,331,13
2021-10-06 21:10:00 UTC,"Target 1 hit on my private discord $LTC trade .. Took a few days to get there, but finally got there   Newsletter has also been sent with updates on $BTC $ETH $LTC $THETA $ONE and more ..   Check it out legends  https://t.co/nIqyxGD7lv ❤️  https://t.co/KsEaC5aJfz",cryptotony__,[],"['ltc', 'btc', 'eth', 'ltc', 'theta', 'one']",5,36,3
2021-10-03 21:08:41 UTC,Thank you as it saves me blocking you 😘,cryptotony__,[],[],0,1,0
2021-10-03 21:01:03 UTC,Everyone on the list deserves to be on there. If you have a different opinion write your own list 😘,cryptotony__,[],[],0,2,2
2021-10-03 19:27:02 UTC,Your very welcome ♥️,cryptotony__,[],[],0,2,0
2021-10-03 19:26:51 UTC,Likewise my friend ♥️,cryptotony__,[],[],0,2,0
2021-10-03 19:26:43 UTC,♥️ Much love Val and you are one of the best Traders i know .. Keep smashing it,cryptotony__,[],[],0,4,1
2021-10-03 18:03:00 UTC,"Shoutout to the babes of CT who rock my feed daily with good TA, Legendary banter and just being supportive of my work and Twitter ♥️",cryptotony__,[],[],10,142,18
2021-10-03 09:33:08 UTC,"Pre warned of the impending breakout yesterday on $XTZ and currently up 17% up .. And we are not done yet ‼️  Check out my daily updates on $BTC $ETH $LTC and many many #Altcoins   For education, my trades and thoughts check out my discord below   https://t.co/nIqyxGD7lv  https://t.co/7AVy1rQKyC",cryptotony__,['altcoins'],"['xtz', 'btc', 'eth', 'ltc']",10,74,6
2021-10-02 21:20:53 UTC,Goodnight legends   Really exciting times if we have bottomed on #Bitcoin in the last couple of days   I am irresponsibly long on a few #Altcoins such as $ZIL $BTC $LTC $ETH $THETA $CRV $ONE and many more   Invalidations in place 💯,cryptotony__,"['bitcoin', 'altcoins']","['zil', 'btc', 'ltc', 'eth', 'theta', 'crv', 'one']",15,144,24
2021-10-02 19:15:08 UTC,"$LTC / $USD - Update   I am currently long with the private discord group on #Litecoin .. I am looking to take some more profit at the supply zone   For anyone not in a trade yet, simply wait for the supply zone to flip into support as per the squiggle  https://t.co/f50tt97KoN",cryptotony__,['litecoin'],"['ltc', 'usd']",18,126,16
2021-10-02 17:31:33 UTC,Who is interested in a $LTC / $USD /  update .. 👀,cryptotony__,[],"['ltc', 'usd']",25,492,52
2021-10-02 06:05:24 UTC,"Good morning legends   First day of October and Q4 and we have already pumped .. I am hoping we see a green October, but I am keeping vigilant incase of any harsh pullbacks .. Until then let’s enjoy the profits 💯   I will updating $LTC $BLIZZ $LIGHT $BTC ..   Green weekend 👀",cryptotony__,[],"['ltc', 'blizz', 'light', 'btc']",8,151,15
2021-09-28 09:29:45 UTC,Just updated my charts and Elliott wave counts on a :  - $BTC  - $ETH  - $LTC  - $MATIC  - $COMP  - $UNI  - $XRP   Come check out the discussions and ideas shared throughout the day ..  https://t.co/nIqyxGD7lv  https://t.co/6AAPqtDWaP,cryptotony__,[],"['btc', 'eth', 'ltc', 'matic', 'comp', 'uni', 'xrp']",11,64,7
2021-09-26 14:14:20 UTC,Just updated this morning $BTC $ETH $LTC $XLM $ADA $ONE $HTR on my private discord 🎉🎊   One other feature is you can also request #Altcoin charts for me and the legend  to assist with 💯  Check it out legends  https://t.co/nIqyxGD7lv  https://t.co/3Ouy923goF,cryptotony__,['altcoin'],"['btc', 'eth', 'ltc', 'xlm', 'ada', 'one', 'htr']",8,32,7
2021-09-25 19:56:06 UTC,Smack his ass back 👀,cryptotony__,[],[],0,4,1
2021-09-24 16:05:12 UTC,You’re very welcome ❤️,cryptotony__,[],[],0,3,0
2021-09-24 13:25:05 UTC,Much love Val ❤️,cryptotony__,[],[],0,2,0
2021-09-24 13:21:14 UTC,Love ya too ❤️,cryptotony__,[],[],0,5,0
2021-09-24 13:21:08 UTC,Much love ❤️,cryptotony__,[],[],0,4,0
2021-09-24 13:17:54 UTC,The girls who rock my CT feed daily 💯                         https://t.co/kkpEaAazWy,cryptotony__,[],[],6,68,27
2021-09-22 09:21:01 UTC,Final target was hit last night on my $ETH #Ethereum trade with the Discord legends .. I’ve also updated this morning   $BTC $ETH $LTC $DOT $UNI $HTR $SOL $BNB $XRP   Check it out for daily updates  https://t.co/nIqyxGUId3  https://t.co/hZeuU97kQ0,cryptotony__,['ethereum'],"['eth', 'btc', 'eth', 'ltc', 'dot', 'uni', 'htr', 'sol', 'bnb', 'xrp']",6,50,5
2021-09-20 19:16:19 UTC,Amen,cryptotony__,[],[],0,8,1
2021-09-20 19:16:11 UTC,Sorry I couldn’t see what you were saying as I don’t wear glasses 😢,cryptotony__,[],[],0,14,2
2021-09-18 20:12:03 UTC,1 month discount applied to my Tier 3 Private Discord 🎉 Here you will find :   - Morning and evening updates on $BTC $ETH $LTC  - Updates on #Altcoins by myself and the legend   - #Altcoin requests daily  - Low risk trades daily   Check it out  https://t.co/nIqyxGD7lv  https://t.co/BFnWOe7P3b,cryptotony__,"['altcoins', 'altcoin']","['btc', 'eth', 'ltc']",3,34,12
2021-09-18 11:43:42 UTC,$LTC / $USD - Update   Nothing much to really update on #Litecoin .. All i can really say is as long as we remain above the range low we are short term bullish  https://t.co/Lw0z1iY8MX,cryptotony__,['litecoin'],"['ltc', 'usd']",8,69,12
2021-09-16 20:09:00 UTC,Lol all you want .. look at how well LTC has done during the last few bear markets. It’s endured and pumped. That to me is a long term hold,cryptotony__,[],[],0,8,1
2021-09-16 20:04:41 UTC,I split my #Crypto capital a few several ways :  - Long term holds ( $BTC $ETH $LTC $ZIL and a few others ) - My trading accounts (Assets I swing trade or scalp) - My gem bags (Spare capital I put into small caps looking for larger swings) - Degen trades (Pre sales)   👌🏻,cryptotony__,['crypto'],"['btc', 'eth', 'ltc', 'zil']",22,193,18
2021-09-13 20:54:56 UTC,"$LTC / $USD - Update   The most Crypto thing to happen right now on #Litecoin is if we retraced the whole dump .. I am not saying it will happen, but it would be a classic Crypto move  https://t.co/mWrkZK4nUH",cryptotony__,['litecoin'],"['ltc', 'usd']",6,131,20
2021-09-13 18:59:09 UTC,I took out a loan and put my life savings into $LTC when I found out .. and now this .. wen refund 😮,cryptotony__,[],['ltc'],1,102,18
2021-09-13 16:55:38 UTC,$LTC / $USD - Update  My target was the supply zone if we remained above the range low as marked out on the chart.. But no i did not get into a position due to fake Walmart news   And for anyone who did FOMO .. Never FOMO into an #Asset ever ‼️  https://t.co/A5etFvUAja,cryptotony__,['asset'],"['ltc', 'usd']",9,67,11
2021-09-09 05:47:44 UTC,"Good Morning legends   While #Bitcoin consolidates prior to a hopeful move up to 48,000 - 50,000 we are witnessing some lovely #Altcoin pumps and set ups   $LTC $SUSHI $AVAX $ZIL to name a few ..",cryptotony__,"['bitcoin', 'altcoin']","['ltc', 'sushi', 'avax', 'zil']",12,175,22
2021-09-08 21:18:32 UTC,"Goodnight legends   Seems we may have a small recovery on our hands if we remain above the swing lows .. I will update #Bitcoin in the morning, but for now the newsletter and Discord subs have been told the plan 💯  A few #Altcoins to take note of are $SRM $LTC $ZIL  $LIFE ..",cryptotony__,"['bitcoin', 'altcoins']","['srm', 'ltc', 'zil', 'life']",13,114,10
2021-09-08 11:27:00 UTC,$LTC / $USD - Update   So like most of the market i am expecting this month to produce some more red candles .. But ideally before we see some relief to draw in some bullish liquidity for the next drop   Either way you must be patient and plan out the next few weeks  https://t.co/KwNZQgA1we,cryptotony__,[],"['ltc', 'usd']",23,114,9
2021-09-08 08:46:00 UTC,I have updated my short term outlook on $LTC / $USD .. Please like and retweet legends and i will share my most likely scenario following the drop yesterday ✅,cryptotony__,[],"['ltc', 'usd']",70,401,13
2021-09-05 20:14:48 UTC,Another nice 13% scalp taken today on $YFI / $USD in the private discord group 😎  Come check out the group legends as we share daily updates for #Altcoins alongside $BTC / $ETH and $LTC  https://t.co/nIqyxGD7lv ⚡️  https://t.co/aDOdunIcSG,cryptotony__,['altcoins'],"['yfi', 'usd', 'btc', 'eth', 'ltc']",4,30,7
2021-09-05 13:39:00 UTC,"My targets for the bull run peak :  $BTC - $100,000 - $150,000 $ETH - $8,000 - $10,000 $LTC - $1,000 - $1,500 $HTR - $15 - $25 $ZIL - $2 - $5 $CELL - $80 - $100  $XRP - $589  $XLM - $2 - $3",cryptotony__,[],"['btc', 'eth', 'ltc', 'htr', 'zil', 'cell', 'xrp', 'xlm']",298,2549,419
2021-09-05 09:08:03 UTC,"Just updated the following #Altcoins in my private discord, with more to come later today :  - $XLM ✅ - $ZIL  ✅ - $AAVE ✅ - $YFI ✅  Daily updates on $BTC $ETH $LTC along with a good community. Check out the link below legends ❤️   https://t.co/nIqyxGD7lv  https://t.co/sgSgxmPtyT",cryptotony__,['altcoins'],"['xlm', 'zil', 'aave', 'yfi', 'btc', 'eth', 'ltc']",11,78,13
2021-09-04 11:10:00 UTC,A couple of #Altcoins i am expecting full pumps on   $XRP ✅ $LTC ✅ $ZIL ✅ $HTR ✅,cryptotony__,['altcoins'],"['xrp', 'ltc', 'zil', 'htr']",57,663,71
2021-09-04 10:45:00 UTC,"$LTC / $USD - Update   Holding the low at $103.34 is what will keep this pumpy dream alive for us .. The momentum over the last few days has been great   If we can continue this momentum i am expecting us to reach the highs in the next couple of weeks, before the real fun starts  https://t.co/ZoltAesv2z",cryptotony__,[],"['ltc', 'usd']",21,121,8
